name,overview,id,poster_path,rating,vote_count,adult,director,producer,creator,actors,year_released,genres,keywords,tags,Unnamed: 15,Unnamed: 16
The Sea Sun,"""Le Soleil De Mer"" is a fast-paced soap opera that blends romance, crime, and passion. With its thrilling three-episode-per-week release schedule, it offers an addictive mix of drama and suspense for viewers.",226924,https://image.tmdb.org/t/p/w500/19AEsm3cuC0ViRnCN2eButBOw4Z.jpg,10.0,1,False,[],[],['Mathis Duret'],[],2020,Soap Comedy Drama Mystery,"['Le', 'Soleil', 'De', 'Mer', 'fast', 'paced', 'soap', 'opera', 'blends', 'romance', 'crime', 'passion', 'thrilling', 'episode', 'week', 'release', 'schedule', 'offers', 'addictive', 'mix', 'drama', 'suspense', 'viewers']",Soap Comedy Drama Mystery  Le Soleil De Mer fast paced soap opera blends romance crime passion thrilling episode week release schedule offers addictive mix drama suspense viewers 10.0  Mathis Duret  ,,
Chase The Truth,"Five years ago, the ""Northwest Wolves"" crime syndicate was annihilated by the police, but the leader of the group, Gumulan, the backbone of the old gun and the undercover agents sent by the police, such as Lin Ke, all disappeared, and it is hard to know whether they are alive or dead. Five years later, the ""Northwest Wolf"" group resurfaced, police Chu Yihan in order to find his mother Lin Ke, took the initiative to become an undercover once again infiltrated into the crime syndicate, in the former deputy chief of the Criminal Investigation Department, the year of the Northwest Wolf case of the main executor of the support of Cheng Fan step by step in-depth the core of the crime syndicate.",239577,https://image.tmdb.org/t/p/w500/weHHbqI3uDotKE2Il0dDPDrITDk.jpg,10.0,2,False,[],[],['Junkai Zhao'],[],2023,Crime Drama Mystery,"['years', 'ago', 'Northwest', 'Wolves', 'crime', 'syndicate', 'annihilated', 'police', 'leader', 'group', 'Gumulan', 'backbone', 'old', 'gun', 'undercover', 'agents', 'sent', 'police', 'Lin', 'Ke', 'disappeared', 'hard', 'know', 'alive', 'dead', 'years', 'later', 'Northwest', 'Wolf', 'group', 'resurfaced', 'police', 'Chu', 'Yihan', 'order', 'find', 'mother', 'Lin', 'Ke', 'took', 'initiative', 'undercover', 'infiltrated', 'crime', 'syndicate', 'deputy', 'chief', 'Criminal', 'Investigation', 'Department', 'year', 'Northwest', 'Wolf', 'case', 'main', 'executor', 'support', 'Cheng', 'Fan', 'step', 'step', 'depth', 'core', 'crime', 'syndicate']",Crime Drama Mystery  years ago Northwest Wolves crime syndicate annihilated police leader group Gumulan backbone old gun undercover agents sent police Lin Ke disappeared hard know alive dead years later Northwest Wolf group resurfaced police Chu Yihan order find mother Lin Ke took initiative undercover infiltrated crime syndicate deputy chief Criminal Investigation Department year Northwest Wolf case main executor support Cheng Fan step step depth core crime syndicate 10.0  Junkai Zhao  ,,
USA High,"USA High is an American teen sitcom which ran from August 1997 to June 1999, and ended after 95 episodes, and reran until August 4, 2001 on the USA Network.",1792,https://image.tmdb.org/t/p/w500/it9TFva1WQIBZzMawgWYi92bBiK.jpg,10.0,4,False,[],[],['Peter Engel'],[],1997,Drama Mystery,"['USA', 'High', 'American', 'teen', 'sitcom', 'ran', 'August', 'June', 'ended', 'episodes', 'reran', 'August', 'USA', 'Network']",Drama Mystery  USA High American teen sitcom ran August June ended episodes reran August USA Network 10.0  Peter Engel  ,,
Playboyy,"When Zouey's best friend Nant goes missing his twin brother Nont comes to investigate. Zouey joins force with First to help Nont solve the case. Delving into Nant's past, the trio find themselves entering a dark communities of the sex industry, illegal pornography, online hook-ups with drug dealing, covert sex work and sex-love revenge exposing human's darkest nature. In the meantime, Zouey—who's afraid of sex—is seduced by his nude model Teena while First delves so deep into the ecstasy of sex when met with Soong, an ex-sex worker, that he might become sex-addicted.

Will they find the missing person? Or will they discover some hidden truth about themselves through this daunting journey?",231260,https://image.tmdb.org/t/p/w500/at246UapGh97fyp7JQMyaNAglrd.jpg,10.0,2,False,[],[],[],[],2023,Drama Mystery,"['Zouey', 'best', 'friend', 'Nant', 'goes', 'missing', 'twin', 'brother', 'Nont', 'comes', 'investigate', 'Zouey', 'joins', 'force', 'help', 'Nont', 'solve', 'case', 'Delving', 'Nant', 'past', 'trio', 'find', 'entering', 'dark', 'communities', 'sex', 'industry', 'illegal', 'pornography', 'online', 'hook', 'ups', 'drug', 'dealing', 'covert', 'sex', 'work', 'sex', 'love', 'revenge', 'exposing', 'human', 'darkest', 'nature', 'meantime', 'Zouey', 'afraid', 'sex', 'seduced', 'nude', 'model', 'Teena', 'delves', 'deep', 'ecstasy', 'sex', 'met', 'Soong', 'ex', 'sex', 'worker', 'sex', 'addicted', 'find', 'missing', 'person', 'discover', 'hidden', 'truth', 'daunting', 'journey']",Drama Mystery  Zouey best friend Nant goes missing twin brother Nont comes investigate Zouey joins force help Nont solve case Delving Nant past trio find entering dark communities sex industry illegal pornography online hook ups drug dealing covert sex work sex love revenge exposing human darkest nature meantime Zouey afraid sex seduced nude model Teena delves deep ecstasy sex met Soong ex sex worker sex addicted find missing person discover hidden truth daunting journey 10.0    ,,
Flying Tiger III,"The terrorist organization ""Waganbu"" infiltrated Hong Kong and set off a battle for chemical weapons in Hong Kong. Fan Shaofeng, the commander of the Flying Tigers, was ordered to fight against the terrorists. The Flying Tigers are trapped in the ruthless killing of Wagambu, the Special Service Superintendent Zhan Bowen convenes the police elites Zhang Weihua, Zhang Jiaxuan and Gao Zile to form a secret counter-terrorism team S Team . Faced with many crises, with the assistance of Interpol Xu Junfei, the two generations of China and Youth finally put aside their grievances and feuds and joined forces to prevent the spread of the chemical weapons virus in Hong Kong.",153613,https://image.tmdb.org/t/p/w500/pG1ThLroUznNT8HHlRENBjHbtBE.jpg,10.0,1,False,[],[],[],[],2021,Mystery Crime,"['terrorist', 'organization', 'Waganbu', 'infiltrated', 'Hong', 'Kong', 'set', 'battle', 'chemical', 'weapons', 'Hong', 'Kong', 'Fan', 'Shaofeng', 'commander', 'Flying', 'Tigers', 'ordered', 'fight', 'terrorists', 'Flying', 'Tigers', 'trapped', 'ruthless', 'killing', 'Wagambu', 'Special', 'Service', 'Superintendent', 'Zhan', 'Bowen', 'convenes', 'police', 'elites', 'Zhang', 'Weihua', 'Zhang', 'Jiaxuan', 'Gao', 'Zile', 'form', 'secret', 'counter', 'terrorism', 'team', 'S', 'Team', 'Faced', 'crises', 'assistance', 'Interpol', 'Xu', 'Junfei', 'generations', 'China', 'Youth', 'finally', 'aside', 'grievances', 'feuds', 'joined', 'forces', 'prevent', 'spread', 'chemical', 'weapons', 'virus', 'Hong', 'Kong']",Mystery Crime  terrorist organization Waganbu infiltrated Hong Kong set battle chemical weapons Hong Kong Fan Shaofeng commander Flying Tigers ordered fight terrorists Flying Tigers trapped ruthless killing Wagambu Special Service Superintendent Zhan Bowen convenes police elites Zhang Weihua Zhang Jiaxuan Gao Zile form secret counter terrorism team S Team Faced crises assistance Interpol Xu Junfei generations China Youth finally aside grievances feuds joined forces prevent spread chemical weapons virus Hong Kong 10.0    ,,
Wu Xin: The Monster Killer,"Wu Xin is an immortal who doesn't know where he was from, how long he lived, or what he is. He wanders the earth with no purpose in life and no money. During one of his destitute spells, he meets Yue Ya who gives him her last morsel of food. To repay her kindness and get more food in their stomach, he decides to capitalize his only skill set: Killing monsters. They begin a wondrous and often dangerous adventure of fighting supernatural evil, one paying customer at a time.",64532,https://image.tmdb.org/t/p/w500/eD8JeAr98KX8Xtlxp6RWK9a94qm.jpg,9.8,5,False,[],[],['蔡藝儂'],[],2015,Mystery Drama Sci-Fi & Fantasy,"['Wu', 'Xin', 'immortal', 'know', 'long', 'lived', 'wanders', 'earth', 'purpose', 'life', 'money', 'destitute', 'spells', 'meets', 'Yue', 'Ya', 'gives', 'morsel', 'food', 'repay', 'kindness', 'food', 'stomach', 'decides', 'capitalize', 'skill', 'set', 'Killing', 'monsters', 'begin', 'wondrous', 'dangerous', 'adventure', 'fighting', 'supernatural', 'evil', 'paying', 'customer', 'time']",Mystery Drama Sci-Fi & Fantasy  Wu Xin immortal know long lived wanders earth purpose life money destitute spells meets Yue Ya gives morsel food repay kindness food stomach decides capitalize skill set Killing monsters begin wondrous dangerous adventure fighting supernatural evil paying customer time 9.8  蔡藝儂  ,,
Balabol,"A happy-go-lucky detective confronts criminals and solves cases with fast-talking, hard-hitting style.",79468,https://image.tmdb.org/t/p/w500/QNWj4vbAkbmT0X65RZ1KkPzsmh.jpg,9.7,3,False,[],[],"['Vladimir Melnik', 'Andrey Shishov', 'Nikita Evgan']",[],2014,Mystery Crime Family,"['happy', 'lucky', 'detective', 'confronts', 'criminals', 'solves', 'cases', 'fast', 'talking', 'hard', 'hitting', 'style']",Mystery Crime Family  happy lucky detective confronts criminals solves cases fast talking hard hitting style 9.7  Vladimir Melnik Andrey Shishov Nikita Evgan  ,,
Hellbound Village,The descendants of an infamous group of bandits investigate a series of brutal murders in their village. Is this karma or the work of a vengeful human?,237936,https://image.tmdb.org/t/p/w500/qlagrKkLuMWGyFYoy674gIXQJPy.jpg,9.667,3,False,[],[],[],[],2023,Mystery Drama,"['descendants', 'infamous', 'group', 'bandits', 'investigate', 'series', 'brutal', 'murders', 'village', 'karma', 'work', 'vengeful', 'human']",Mystery Drama  descendants infamous group bandits investigate series brutal murders village karma work vengeful human 9.667    ,,
"Roswell Conspiracies: Aliens, Myths and Legends","A group of allied intelligence agents discover that extraterrestrial beings arrived on Earth centuries ago and have been thriving through the exploitation of humans. Believed to be the origins of many of the creatures humans know from myth, folklore and legends, including vampires and werewolves, the group discovers that these aliens have now formed a sinister cadre bent on taking over the world for themselves. In response, the agents form a top-secret multinational agency known as The Global Alliance, charged with protecting the world from the alien threat and keeping it a secret from the public at any cost.",4390,https://image.tmdb.org/t/p/w500/4PdFAwbiG7oUFzs2TEJSjahrvXk.jpg,9.2,4,False,[],[],['Kaaren Lee Brown'],[],1999,Animation Sci-Fi & Fantasy Action & Adventure Mystery,"['group', 'allied', 'intelligence', 'agents', 'discover', 'extraterrestrial', 'beings', 'arrived', 'Earth', 'centuries', 'ago', 'thriving', 'exploitation', 'humans', 'Believed', 'origins', 'creatures', 'humans', 'know', 'myth', 'folklore', 'legends', 'including', 'vampires', 'werewolves', 'group', 'discovers', 'aliens', 'formed', 'sinister', 'cadre', 'bent', 'taking', 'world', 'response', 'agents', 'form', 'secret', 'multinational', 'agency', 'known', 'Global', 'Alliance', 'charged', 'protecting', 'world', 'alien', 'threat', 'keeping', 'secret', 'public', 'cost']",Animation Sci-Fi & Fantasy Action & Adventure Mystery  group allied intelligence agents discover extraterrestrial beings arrived Earth centuries ago thriving exploitation humans Believed origins creatures humans know myth folklore legends including vampires werewolves group discovers aliens formed sinister cadre bent taking world response agents form secret multinational agency known Global Alliance charged protecting world alien threat keeping secret public cost 9.2  Kaaren Lee Brown  ,,
Amazing Detective Di Renjie,"Di Renjie is Tang dynasty magistrate and statesman, who investigates mysterious murders.",44277,https://image.tmdb.org/t/p/w500/tIdH4eYwzl1kcz26G5aB6oHjIpa.jpg,9.2,9,False,[],[],['Qian Yanqiu'],[],2004,Drama Mystery,"['Di', 'Renjie', 'Tang', 'dynasty', 'magistrate', 'statesman', 'investigates', 'mysterious', 'murders']",Drama Mystery  Di Renjie Tang dynasty magistrate statesman investigates mysterious murders 9.2  Qian Yanqiu  ,,
The Elegant Empire,A man and a woman take revenge desperately yet elegantly after being trampled on by enormous power.,229947,https://image.tmdb.org/t/p/w500/w4HHWY2sZrwPvvA9qy4dpYPSVPp.jpg,9.0,3,False,[],[],[],[],2023,Drama Mystery,"['man', 'woman', 'revenge', 'desperately', 'elegantly', 'trampled', 'enormous', 'power']",Drama Mystery  man woman revenge desperately elegantly trampled enormous power 9.0    ,,
Nazar,"The Rathods may look like a normal family, but they have been reeling under the evil sight, 'nazar' of a supernatural entity, a Daayan. And once fallen, it never leaves…",81927,https://image.tmdb.org/t/p/w500/wPdryS0QZ38SeXvjrRmbBbkxlYE.jpg,9.0,2,False,[],[],"['Mrinal Jha', 'Gul Khan']",[],2018,Mystery Sci-Fi & Fantasy,"['Rathods', 'look', 'like', 'normal', 'family', 'reeling', 'evil', 'sight', 'nazar', 'supernatural', 'entity', 'Daayan', 'fallen', 'leaves']",Mystery Sci-Fi & Fantasy  Rathods look like normal family reeling evil sight nazar supernatural entity Daayan fallen leaves 9.0  Mrinal Jha Gul Khan  ,,
The Eight,"HaShminiya is a television series that was broadcast on the Israeli channel Arutz HaYeladim in HOT. Although the show was designated for children and teenagers, it was also popular with adults.",15951,https://image.tmdb.org/t/p/w500/ilxPdoKcPdEzZNtIY2Ecx42VAVj.jpg,9.0,1,False,[],[],['Giora Chamizer'],[],2005,Drama Comedy Kids Sci-Fi & Fantasy Mystery,"['HaShminiya', 'television', 'series', 'broadcast', 'Israeli', 'channel', 'Arutz', 'HaYeladim', 'HOT', 'designated', 'children', 'teenagers', 'popular', 'adults']",Drama Comedy Kids Sci-Fi & Fantasy Mystery  HaShminiya television series broadcast Israeli channel Arutz HaYeladim HOT designated children teenagers popular adults 9.0  Giora Chamizer  ,,
The investigation was conducted,The author's cycle of documentary programs of the NTV channel about the most high-profile crimes committed in the USSR. The story is accompanied by stories about the daily life of the inhabitants of the USSR. Presenter - Leonid Kanevskiy. Documentary television films are devoted to criminal cases from 1917 to 1991.,55165,https://image.tmdb.org/t/p/w500/34k0DF72T1zMuIXmSA34dypZIjq.jpg,8.875,8,False,[],[],[],[],2006,Mystery Documentary,"['author', 'cycle', 'documentary', 'programs', 'NTV', 'channel', 'high', 'profile', 'crimes', 'committed', 'USSR', 'story', 'accompanied', 'stories', 'daily', 'life', 'inhabitants', 'USSR', 'Presenter', 'Leonid', 'Kanevskiy', 'Documentary', 'television', 'films', 'devoted', 'criminal', 'cases']",Mystery Documentary  author cycle documentary programs NTV channel high profile crimes committed USSR story accompanied stories daily life inhabitants USSR Presenter Leonid Kanevskiy Documentary television films devoted criminal cases 8.875    ,,
The Vampires of Midland,"Grandpa Slava is the oldest of the Midland vampire family. They live quietly. They live by the law. They live the unremarkable life of an ordinary Russian family and they never kill humans – ever. Although, of course, everyone knows they drink blood. And when some lifeless corpses are found in a birch grove near Smolensk... their peaceful life falls under threat.",105136,https://image.tmdb.org/t/p/w500/7AHDGuOm0pefzw4tyZ7s13VAQ8P.jpg,8.804,56,False,[],[],['Alexey Akimov'],[],2021,Mystery Comedy Sci-Fi & Fantasy,"['Grandpa', 'Slava', 'oldest', 'Midland', 'vampire', 'family', 'live', 'quietly', 'live', 'law', 'live', 'unremarkable', 'life', 'ordinary', 'Russian', 'family', 'kill', 'humans', 'course', 'knows', 'drink', 'blood', 'lifeless', 'corpses', 'found', 'birch', 'grove', 'near', 'Smolensk', 'peaceful', 'life', 'falls', 'threat']",Mystery Comedy Sci-Fi & Fantasy  Grandpa Slava oldest Midland vampire family live quietly live law live unremarkable life ordinary Russian family kill humans course knows drink blood lifeless corpses found birch grove near Smolensk peaceful life falls threat 8.804  Alexey Akimov  ,,
The Long Season,"In the small town of Hualin, taxi driver Wang Xiang had the chance to meet the person he both most wanted and feared to encounter in his life. Meeting this person would require an explanation, for himself and for his son. Wang Xiang was full of confidence as a train driver, but struggled with the trivialities of his own small family. The factory was on the verge of collapse, and the discovery of an unidentified dismembered body struck Wang Xiang's mind.

For twenty years, Wang Xiang was trapped in three different eras, chasing after the truth that crossed the past, present, and future, all to solve an unsolved mystery. When the answer was finally revealed, time and space merged into one, and only the dirge of fate remained in the long seasons.",225008,https://image.tmdb.org/t/p/w500/rM5Y0ziZbmpkqW1db2HK3xrzTXj.jpg,8.712,59,False,[],[],['Xin Shuang'],[],2023,Drama Family Crime Mystery,"['small', 'town', 'Hualin', 'taxi', 'driver', 'Wang', 'Xiang', 'chance', 'meet', 'person', 'wanted', 'feared', 'encounter', 'life', 'Meeting', 'person', 'require', 'explanation', 'son', 'Wang', 'Xiang', 'confidence', 'train', 'driver', 'struggled', 'trivialities', 'small', 'family', 'factory', 'verge', 'collapse', 'discovery', 'unidentified', 'dismembered', 'body', 'struck', 'Wang', 'Xiang', 'mind', 'years', 'Wang', 'Xiang', 'trapped', 'different', 'eras', 'chasing', 'truth', 'crossed', 'past', 'present', 'future', 'solve', 'unsolved', 'mystery', 'answer', 'finally', 'revealed', 'time', 'space', 'merged', 'dirge', 'fate', 'remained', 'long', 'seasons']",Drama Family Crime Mystery  small town Hualin taxi driver Wang Xiang chance meet person wanted feared encounter life Meeting person require explanation son Wang Xiang confidence train driver struggled trivialities small family factory verge collapse discovery unidentified dismembered body struck Wang Xiang mind years Wang Xiang trapped different eras chasing truth crossed past present future solve unsolved mystery answer finally revealed time space merged dirge fate remained long seasons 8.712  Xin Shuang  ,,
Evil Minds,"A gifted criminal profiler lost someone important to him while he was helping the police solve a bizarre campus serial killing. The lost crippled his mind and left him unable to profile again. But when another serial killing threatened the city, he had to confront his inner demon in order to track down the serial killer.",69714,https://image.tmdb.org/t/p/w500/Alw3GV6OBr1LaWVUOF0SXDNS6Ih.jpg,8.7,3,False,[],[],[],[],2015,Crime Drama Mystery,"['gifted', 'criminal', 'profiler', 'lost', 'important', 'helping', 'police', 'solve', 'bizarre', 'campus', 'serial', 'killing', 'lost', 'crippled', 'mind', 'left', 'unable', 'profile', 'serial', 'killing', 'threatened', 'city', 'confront', 'inner', 'demon', 'order', 'track', 'serial', 'killer']",Crime Drama Mystery  gifted criminal profiler lost important helping police solve bizarre campus serial killing lost crippled mind left unable profile serial killing threatened city confront inner demon order track serial killer 8.7    ,,
Senior High,"A student’s death causes a scandal at the prestigious Northford High. Investigations conclude it was a suicide. The victim’s twin sister thinks otherwise. As she searches for truth, she will unravel secrets that are far more shocking and dangerous.",226773,https://image.tmdb.org/t/p/w500/k285iD6gZIoLsVSczSjc4WIXkdc.jpg,8.667,3,False,[],[],[],[],2023,Drama Mystery,"['student', 'death', 'causes', 'scandal', 'prestigious', 'Northford', 'High', 'Investigations', 'conclude', 'suicide', 'victim', 'twin', 'sister', 'thinks', 'searches', 'truth', 'unravel', 'secrets', 'far', 'shocking', 'dangerous']",Drama Mystery  student death causes scandal prestigious Northford High Investigations conclude suicide victim twin sister thinks searches truth unravel secrets far shocking dangerous 8.667    ,,
Huntik: Secrets & Seekers,"Huntik: Secrets & Seekers is an Italian/American animated television series, begun in 2009, created and directed by Iginio Straffi. It was a co-production between Big Bocca Productions, a company owned by Richard McWilliam, CEO and owner of Upper Deck and Rainbow S.p.A. It acts like one of the spin-offs to the Winx Club series. All of the show's designs, animation and visual style were created in Italy, while the scriptwriting and original voice recording were done in the United States. It aired on The CW4Kids at 11:30am Eastern Standard Time on Saturdays. In Europe, the series used to air on Disney XD, and on CITV. In India, the series' first season aired on Disney XD in 2010. The series premiered on January 3, 2009, with one episode in the US and the first four episodes in Europe, making Jetix the home for premieres beyond the first episode. It was revealed in a magazine with the new season of the Winx Club, that the second season of Huntik would air in fall 2012 in the US. However, the second season began airing in the spring of 2012 in UK on CITV & Australia on channel eleven. The first season was released on DVD by Anime Works in 2010.",16361,https://image.tmdb.org/t/p/w500/r8dMX8wrc1Q7KAd8NmxgmUlsz6c.jpg,8.65,30,False,[],[],['Iginio Straffi'],[],2009,Animation Sci-Fi & Fantasy Mystery Action & Adventure,"['Huntik', 'Secrets', 'Seekers', 'Italian', 'American', 'animated', 'television', 'series', 'begun', 'created', 'directed', 'Iginio', 'Straffi', 'co', 'production', 'Big', 'Bocca', 'Productions', 'company', 'owned', 'Richard', 'McWilliam', 'CEO', 'owner', 'Upper', 'Deck', 'Rainbow', 'acts', 'like', 'spin', 'offs', 'Winx', 'Club', 'series', 'designs', 'animation', 'visual', 'style', 'created', 'Italy', 'scriptwriting', 'original', 'voice', 'recording', 'United', 'States', 'aired', 'Eastern', 'Standard', 'Time', 'Saturdays', 'Europe', 'series', 'air', 'Disney', 'XD', 'CITV', 'India', 'series', 'season', 'aired', 'Disney', 'XD', 'series', 'premiered', 'January', 'episode', 'episodes', 'Europe', 'making', 'Jetix', 'home', 'premieres', 'episode', 'revealed', 'magazine', 'new', 'season', 'Winx', 'Club', 'second', 'season', 'Huntik', 'air', 'fall', 'second', 'season', 'began', 'airing', 'spring', 'UK', 'CITV', 'Australia', 'channel', 'season', 'released', 'DVD', 'Anime', 'Works']",Animation Sci-Fi & Fantasy Mystery Action & Adventure  Huntik Secrets Seekers Italian American animated television series begun created directed Iginio Straffi co production Big Bocca Productions company owned Richard McWilliam CEO owner Upper Deck Rainbow acts like spin offs Winx Club series designs animation visual style created Italy scriptwriting original voice recording United States aired Eastern Standard Time Saturdays Europe series air Disney XD CITV India series season aired Disney XD series premiered January episode episodes Europe making Jetix home premieres episode revealed magazine new season Winx Club second season Huntik air fall second season began airing spring UK CITV Australia channel season released DVD Anime Works 8.65  Iginio Straffi  ,,
Death Note,"Light Yagami is an ace student with great prospects—and he’s bored out of his mind. But all that changes when he finds the Death Note, a notebook dropped by a rogue Shinigami death god. Any human whose name is written in the notebook dies, and Light has vowed to use the power of the Death Note to rid the world of evil. But will Light succeed in his noble goal, or will the Death Note turn him into the very thing he fights against?",13916,https://image.tmdb.org/t/p/w500/iigTJJskR1PcjjXqxdyJwVB3BoU.jpg,8.638,3702,False,[],[],[],[],2006,Animation Mystery Sci-Fi & Fantasy,"['Light', 'Yagami', 'ace', 'student', 'great', 'prospects', 'bored', 'mind', 'changes', 'finds', 'Death', 'Note', 'notebook', 'dropped', 'rogue', 'Shinigami', 'death', 'god', 'human', 'written', 'notebook', 'dies', 'Light', 'vowed', 'use', 'power', 'Death', 'Note', 'rid', 'world', 'evil', 'Light', 'succeed', 'noble', 'goal', 'Death', 'Note', 'turn', 'thing', 'fights']",Animation Mystery Sci-Fi & Fantasy  Light Yagami ace student great prospects bored mind changes finds Death Note notebook dropped rogue Shinigami death god human written notebook dies Light vowed use power Death Note rid world evil Light succeed noble goal Death Note turn thing fights 8.638    ,,
Stranger Things,"When a young boy vanishes, a small town uncovers a mystery involving secret experiments, terrifying supernatural forces, and one strange little girl.",66732,https://image.tmdb.org/t/p/w500/49WJfeN0moxb9IPfGn8AIqMGskD.jpg,8.623,16392,False,[],[],"['Matt Duffer', 'Ross Duffer']",[],2016,Drama Sci-Fi & Fantasy Mystery,"['young', 'boy', 'vanishes', 'small', 'town', 'uncovers', 'mystery', 'involving', 'secret', 'experiments', 'terrifying', 'supernatural', 'forces', 'strange', 'little', 'girl']",Drama Sci-Fi & Fantasy Mystery  young boy vanishes small town uncovers mystery involving secret experiments terrifying supernatural forces strange little girl 8.623  Matt Duffer Ross Duffer  ,,
