name,overview,id,poster_path,rating,vote_count,adult,director,producer,creator,actors,year_released,genres,keywords,tags,Unnamed: 15,Unnamed: 16
Stephen King's Kingdom Hospital,"Kingdom is a hospital whose bizarre population includes a brilliant surgeon who lives in the basement, a nearly blind security guard and a nurse who regularly faints at the sight of blood. But when patients and staff hear the voice of a girl crying through the halls and a patient destined for life as a paraplegic miraculously recovers, they are dismissive of any suggestion of mysticism or unseen powers... at their own peril.",1617,https://image.tmdb.org/t/p/w500/A3Sk7JU26EEmW5eK3TYWh6AEAcE.jpg,6.9,105,False,[],[],"['Lars von Trier', 'Stephen King']",[],2004,Mystery Drama Sci-Fi & Fantasy,"['Kingdom', 'hospital', 'bizarre', 'population', 'includes', 'brilliant', 'surgeon', 'lives', 'basement', 'nearly', 'blind', 'security', 'guard', 'nurse', 'regularly', 'faints', 'sight', 'blood', 'patients', 'staff', 'hear', 'voice', 'girl', 'crying', 'halls', 'patient', 'destined', 'life', 'paraplegic', 'miraculously', 'recovers', 'dismissive', 'suggestion', 'mysticism', 'unseen', 'powers', 'peril']",Mystery Drama Sci-Fi & Fantasy  Kingdom hospital bizarre population includes brilliant surgeon lives basement nearly blind security guard nurse regularly faints sight blood patients staff hear voice girl crying halls patient destined life paraplegic miraculously recovers dismissive suggestion mysticism unseen powers peril 6.9  Lars von Trier Stephen King  ,,
It,"In 1960, seven outcast kids known as ""The Losers' Club"" fight an evil demon who poses as a child-killing clown. Thirty years later, they reunite to stop the demon once and for all when it returns to their hometown.",19614,https://image.tmdb.org/t/p/w500/4ybQ6gopB3H3cu0seVZLznDnIKo.jpg,6.9,2820,False,[],[],['Stephen King'],[],1990,Mystery Drama,"['seven', 'outcast', 'kids', 'known', 'Losers', 'Club', 'fight', 'evil', 'demon', 'poses', 'child', 'killing', 'clown', 'Thirty', 'years', 'later', 'reunite', 'stop', 'demon', 'returns', 'hometown']",Mystery Drama  seven outcast kids known Losers Club fight evil demon poses child killing clown Thirty years later reunite stop demon returns hometown 6.9  Stephen King  ,,
Haruchika – Haruta & Chika,"Haruta and Chika are members of their high school wind instrument club that is on the verge of being shut down. The two are childhood friends, and they spend their days practicing hard while also trying to recruit new members. When a certain incident happens within their school, they work together to solve it.",65177,https://image.tmdb.org/t/p/w500/8J9yrbDdqJJkIpsjhGXHsrkA4Il.jpg,6.9,9,False,[],[],[],[],2016,Animation Mystery,"['Haruta', 'Chika', 'members', 'high', 'school', 'wind', 'instrument', 'club', 'verge', 'shut', 'childhood', 'friends', 'spend', 'days', 'practicing', 'hard', 'trying', 'recruit', 'new', 'members', 'certain', 'incident', 'happens', 'school', 'work', 'solve']",Animation Mystery  Haruta Chika members high school wind instrument club verge shut childhood friends spend days practicing hard trying recruit new members certain incident happens school work solve 6.9    ,,
The Rivals of Sherlock Holmes,Adaptations of mystery stories written by Sir Arthur Conan Doyle's contemporary rivals in the genre.,12964,https://image.tmdb.org/t/p/w500/3sfRBSpBT6k5mEANa53T6hFg5lk.jpg,6.9,8,False,[],[],['Hugh Greene'],[],1971,Crime Drama Mystery,"['Adaptations', 'mystery', 'stories', 'written', 'Sir', 'Arthur', 'Conan', 'Doyle', 'contemporary', 'rivals', 'genre']",Crime Drama Mystery  Adaptations mystery stories written Sir Arthur Conan Doyle contemporary rivals genre 6.9  Hugh Greene  ,,
Dispatches from Elsewhere,A group of ordinary people who stumble onto a puzzle hiding just behind the veil of everyday life come to find that the mystery winds far deeper than they ever imagined.,81241,https://image.tmdb.org/t/p/w500/zMgkk0ri4IieIJKjKSROAFFl29p.jpg,6.9,95,False,[],[],['Jason Segel'],[],2020,Drama Mystery,"['group', 'ordinary', 'people', 'stumble', 'puzzle', 'hiding', 'veil', 'everyday', 'life', 'come', 'find', 'mystery', 'winds', 'far', 'deeper', 'imagined']",Drama Mystery  group ordinary people stumble puzzle hiding veil everyday life come find mystery winds far deeper imagined 6.9  Jason Segel  ,,
The Dead Files,Psychic medium Amy Allan and former NYPD homicide detective Steve DiSchiavi investigate locations that are reported to be haunted.,40971,https://image.tmdb.org/t/p/w500/44LifGcFC0n1vsuyU0rcNWc8Gx8.jpg,6.9,56,False,[],[],[],[],2011,Documentary Mystery Reality,"['Psychic', 'medium', 'Amy', 'Allan', 'NYPD', 'homicide', 'detective', 'Steve', 'DiSchiavi', 'investigate', 'locations', 'reported', 'haunted']",Documentary Mystery Reality  Psychic medium Amy Allan NYPD homicide detective Steve DiSchiavi investigate locations reported haunted 6.9    ,,
GHOUL,A newly minted military interrogator arrives at a covert detention center to discover that some of the terrorists held there are not of this world.,80707,https://image.tmdb.org/t/p/w500/r3cbfNl77zK7XhFMNpdbxy0B7gW.jpg,6.9,176,False,[],[],['Patrick Graham'],[],2018,Mystery Sci-Fi & Fantasy Drama,"['newly', 'minted', 'military', 'interrogator', 'arrives', 'covert', 'detention', 'center', 'discover', 'terrorists', 'held', 'world']",Mystery Sci-Fi & Fantasy Drama  newly minted military interrogator arrives covert detention center discover terrorists held world 6.9  Patrick Graham  ,,
Blood Curse,"A young woman witnessing black magic attack on her family which changes her view towards the world. Driven to protect them at any cost, the woman will go to the ends of the earth to find out who is responsible and hold them to account.",221166,https://image.tmdb.org/t/p/w500/8u2dpmG0oB3jrTbRYnmQHbFwU54.jpg,6.9,14,False,[],[],['Kimo Stamboel'],[],2023,Mystery,"['young', 'woman', 'witnessing', 'black', 'magic', 'attack', 'family', 'changes', 'view', 'world', 'Driven', 'protect', 'cost', 'woman', 'ends', 'earth', 'find', 'responsible', 'hold', 'account']",Mystery  young woman witnessing black magic attack family changes view world Driven protect cost woman ends earth find responsible hold account 6.9  Kimo Stamboel  ,,
Ironside,"When an assassin's bullet confines him to a wheelchair for life ending his career as Chief of Detectives, Robert T. Ironside becomes a consultant to the police department. Detective Sergeant Ed Brown and policewoman Eve Whitfield join with him to crack varied and fascinating cases. Ex-con Mark Sanger is employed by the chief as home help but eventually becomes a fully fledged member of the team also. Officer Whitfield leaves after 4 years service, and is replaced by Officer Fran Belding.",4582,https://image.tmdb.org/t/p/w500/Fu9Sv0pQ0s89uWwwXcaG0kiNW7.jpg,6.9,56,False,[],[],['Collier Young'],[],1967,Crime Drama Mystery,"['assassin', 'bullet', 'confines', 'wheelchair', 'life', 'ending', 'career', 'Chief', 'Detectives', 'Robert', 'Ironside', 'consultant', 'police', 'department', 'Detective', 'Sergeant', 'Ed', 'Brown', 'policewoman', 'Eve', 'Whitfield', 'join', 'crack', 'varied', 'fascinating', 'cases', 'Ex', 'con', 'Mark', 'Sanger', 'employed', 'chief', 'home', 'help', 'eventually', 'fully', 'fledged', 'member', 'team', 'Officer', 'Whitfield', 'leaves', 'years', 'service', 'replaced', 'Officer', 'Fran', 'Belding']",Crime Drama Mystery  assassin bullet confines wheelchair life ending career Chief Detectives Robert Ironside consultant police department Detective Sergeant Ed Brown policewoman Eve Whitfield join crack varied fascinating cases Ex con Mark Sanger employed chief home help eventually fully fledged member team Officer Whitfield leaves years service replaced Officer Fran Belding 6.9  Collier Young  ,,
Fortitude,"Fortitude is a place like nowhere else. Although surrounded by the savage beauty of the Arctic landscape, Fortitude is one of the safest towns on earth. There has never been a violent crime here. Until now. In such a close-knit community a murder touches everyone and the unsettling, mysterious horror of this crime threatens the future of the town itself.",61335,https://image.tmdb.org/t/p/w500/u6vKMeFEfz9sJun65EZgp4ltr9r.jpg,6.9,235,False,[],[],['Simon Donald'],[],2015,Crime Drama Mystery Sci-Fi & Fantasy,"['Fortitude', 'place', 'like', 'surrounded', 'savage', 'beauty', 'Arctic', 'landscape', 'Fortitude', 'safest', 'towns', 'earth', 'violent', 'crime', 'close', 'knit', 'community', 'murder', 'touches', 'unsettling', 'mysterious', 'horror', 'crime', 'threatens', 'future', 'town']",Crime Drama Mystery Sci-Fi & Fantasy  Fortitude place like surrounded savage beauty Arctic landscape Fortitude safest towns earth violent crime close knit community murder touches unsettling mysterious horror crime threatens future town 6.9  Simon Donald  ,,
Intimacy,A rising politician's career is threatened when a surreptitiously recorded video of her sex life is leaked to the public.,123534,https://image.tmdb.org/t/p/w500/a5OSupEApopDRvC3gZb661LoChb.jpg,6.9,61,False,[],[],"['Verónica Fernández', 'Laura Sarmiento']",[],2022,Drama Mystery,"['rising', 'politician', 'career', 'threatened', 'surreptitiously', 'recorded', 'video', 'sex', 'life', 'leaked', 'public']",Drama Mystery  rising politician career threatened surreptitiously recorded video sex life leaked public 6.9  Verónica Fernández Laura Sarmiento  ,,
MARS RED,"It’s 1923, and the mysterious blood source Ascra has unleashed a horde of vampires across Japan. In response, the government spawns Code Zero. With S-rank vampire Defrott and the rookie Kurusu, this kill squad is made for one reason: to hunt the undead!",99099,https://image.tmdb.org/t/p/w500/z0AaUo0hCb2RF2JGr9AmaDyJj7d.jpg,6.9,37,False,[],[],[],[],2021,Animation Mystery Sci-Fi & Fantasy,"['mysterious', 'blood', 'source', 'Ascra', 'unleashed', 'horde', 'vampires', 'Japan', 'response', 'government', 'spawns', 'Code', 'Zero', 'S', 'rank', 'vampire', 'Defrott', 'rookie', 'Kurusu', 'kill', 'squad', 'reason', 'hunt', 'undead']",Animation Mystery Sci-Fi & Fantasy  mysterious blood source Ascra unleashed horde vampires Japan response government spawns Code Zero S rank vampire Defrott rookie Kurusu kill squad reason hunt undead 6.9    ,,
The Dresden Files,A Chicago-based wizard works as a private investigator.,4955,https://image.tmdb.org/t/p/w500/rujRcP9fZAk7Sq0U8iDITOXouCW.jpg,6.899,79,False,[],[],['Jim Butcher'],[],2007,Sci-Fi & Fantasy Mystery Drama Action & Adventure,"['Chicago', 'based', 'wizard', 'works', 'private', 'investigator']",Sci-Fi & Fantasy Mystery Drama Action & Adventure  Chicago based wizard works private investigator 6.899  Jim Butcher  ,,
The Midnight Club,"At a manor with a mysterious history, the 8 members of the Midnight Club meet each night at midnight to tell sinister stories – and to look for signs of the supernatural from the beyond.",126254,https://image.tmdb.org/t/p/w500/2Y4F9BHkacKIMnDBZI3GGKpG1If.jpg,6.899,207,False,[],[],"['Mike Flanagan', 'Leah Fong']",[],2022,Drama Mystery,"['manor', 'mysterious', 'history', 'members', 'Midnight', 'Club', 'meet', 'night', 'midnight', 'tell', 'sinister', 'stories', 'look', 'signs', 'supernatural']",Drama Mystery  manor mysterious history members Midnight Club meet night midnight tell sinister stories look signs supernatural 6.899  Mike Flanagan Leah Fong  ,,
Cuna de lobos,"After causing the death of her millionaire husband Carlos, Catalina Creel, whose great beauty is only surpassed by her cruelty, will go to any lengths to secure her fortune and bloodline.",93394,https://image.tmdb.org/t/p/w500/n1xy8a7n6GpKEjqxkMFbe8TGC1x.jpg,6.898,191,False,[],[],['Carlos Olmos'],[],2019,Drama Mystery Soap,"['causing', 'death', 'millionaire', 'husband', 'Carlos', 'Catalina', 'Creel', 'great', 'beauty', 'surpassed', 'cruelty', 'lengths', 'secure', 'fortune', 'bloodline']",Drama Mystery Soap  causing death millionaire husband Carlos Catalina Creel great beauty surpassed cruelty lengths secure fortune bloodline 6.898  Carlos Olmos  ,,
Maigret,"BBC series based on the novels by Georges Simenon which starred Rupert Davies as Inspector Maigret, a French police detective who preferred to watch and listen in order to solve crimes. The series ran from 1960-63 on British television.",26992,https://image.tmdb.org/t/p/w500/m7LeiPJWWBxUQAMqtVtMednva0c.jpg,6.889,9,False,[],[],[],[],1960,Crime Drama Mystery,"['BBC', 'series', 'based', 'novels', 'Georges', 'Simenon', 'starred', 'Rupert', 'Davies', 'Inspector', 'Maigret', 'French', 'police', 'detective', 'preferred', 'watch', 'listen', 'order', 'solve', 'crimes', 'series', 'ran', 'British', 'television']",Crime Drama Mystery  BBC series based novels Georges Simenon starred Rupert Davies Inspector Maigret French police detective preferred watch listen order solve crimes series ran British television 6.889    ,,
The Forest,"In a small quiet village in the Ardennes, a sixteen-year-old girl disappears into the forest after calling her teacher in the middle of the night. Captain Gaspard Deker, a former soldier and newly arrived single father is conducting the investigation with Virginie Musso, the local cop. Also helping is the teacher, Eve Mendel, a solitary young woman with a mysterious past: she was found as a child by the villiage doctor wandering silently in the same forest.",71967,https://image.tmdb.org/t/p/w500/gomZ0inbIl5zm9jdMqcdzMvjKdp.jpg,6.884,108,False,[],[],['Delinda Jacobs'],[],2017,Crime Drama Mystery,"['small', 'quiet', 'village', 'Ardennes', 'sixteen', 'year', 'old', 'girl', 'disappears', 'forest', 'calling', 'teacher', 'middle', 'night', 'Captain', 'Gaspard', 'Deker', 'soldier', 'newly', 'arrived', 'single', 'father', 'conducting', 'investigation', 'Virginie', 'Musso', 'local', 'cop', 'helping', 'teacher', 'Eve', 'Mendel', 'solitary', 'young', 'woman', 'mysterious', 'past', 'found', 'child', 'villiage', 'doctor', 'wandering', 'silently', 'forest']",Crime Drama Mystery  small quiet village Ardennes sixteen year old girl disappears forest calling teacher middle night Captain Gaspard Deker soldier newly arrived single father conducting investigation Virginie Musso local cop helping teacher Eve Mendel solitary young woman mysterious past found child villiage doctor wandering silently forest 6.884  Delinda Jacobs  ,,
Scream: The TV Series,"What starts as a YouTube video going viral, soon leads to problems for the teenagers of Lakewood and serves as the catalyst for a murder that opens up a window to the town's troubled past. Everyone has secrets. Everyone tells lies. Everyone is fair game.",62823,https://image.tmdb.org/t/p/w500/cTRUcUnAydqboYfis0IhhY1edDt.jpg,6.881,1057,False,[],[],"['Jill E. Blotevogel', 'Jay Beattie', 'Dan Dworkin']",[],2015,Drama Crime Mystery,"['starts', 'YouTube', 'video', 'going', 'viral', 'soon', 'leads', 'problems', 'teenagers', 'Lakewood', 'serves', 'catalyst', 'murder', 'opens', 'window', 'town', 'troubled', 'past', 'secrets', 'tells', 'lies', 'fair', 'game']",Drama Crime Mystery  starts YouTube video going viral soon leads problems teenagers Lakewood serves catalyst murder opens window town troubled past secrets tells lies fair game 6.881  Jill E. Blotevogel Jay Beattie Dan Dworkin  ,,
Boogiepop Phantom,"Five years ago, a string of grisly murders shook the city to its core and now the rumors have begun once more. Boogiepop... Everyone knows about Boogiepop: meet her one dark night and you are taken. People tell each other the stories and laugh: no one believes that she can possibly exist in this day and age. Still, strange things appear to be going on and the darkness is taking on many forms. Something is out there.",34152,https://image.tmdb.org/t/p/w500/oldWjJaCGGyHjfh5aKKs4VKzXav.jpg,6.88,25,False,[],[],['Kouhei Kadono'],[],2000,Animation Mystery Drama,"['years', 'ago', 'string', 'grisly', 'murders', 'shook', 'city', 'core', 'rumors', 'begun', 'Boogiepop', 'knows', 'Boogiepop', 'meet', 'dark', 'night', 'taken', 'People', 'tell', 'stories', 'laugh', 'believes', 'possibly', 'exist', 'day', 'age', 'strange', 'things', 'appear', 'going', 'darkness', 'taking', 'forms']",Animation Mystery Drama  years ago string grisly murders shook city core rumors begun Boogiepop knows Boogiepop meet dark night taken People tell stories laugh believes possibly exist day age strange things appear going darkness taking forms 6.88  Kouhei Kadono  ,,
I Know What You Did Last Summer,"In a sun-soaked Hawaiian town with a mysterious past, a group of friends is left with a dark secret after a tragic accident. One year later, a member of the group receives a threatening message, and the friends now know that someone intends to make them pay for last summer.",129680,https://image.tmdb.org/t/p/w500/udvw5tHwEu8VI7e07qpVLZAw8o2.jpg,6.874,178,False,[],[],"['Craig Macneill', 'Benjamin Semanoff', 'Logan Kibens']",[],2021,Drama Mystery,"['sun', 'soaked', 'Hawaiian', 'town', 'mysterious', 'past', 'group', 'friends', 'left', 'dark', 'secret', 'tragic', 'accident', 'year', 'later', 'member', 'group', 'receives', 'threatening', 'message', 'friends', 'know', 'intends', 'pay', 'summer']",Drama Mystery  sun soaked Hawaiian town mysterious past group friends left dark secret tragic accident year later member group receives threatening message friends know intends pay summer 6.874  Craig Macneill Benjamin Semanoff Logan Kibens  ,,
The Five,"When they were twelve years old, Mark, Pru, Danny and Slade were out together in the park. Mark’s five-year-old brother, Jesse, was annoying them. They were mean – told him to get lost. Jesse ran away. He was gone. Never seen again. Twenty years later, Danny – now a detective – learns some shocking news. Jesse’s DNA has been found at a murder scene. He is alive and out there. Somewhere.",66238,https://image.tmdb.org/t/p/w500/dAWDDSMkx0A1D9QbiBeUoV954qF.jpg,6.864,81,False,[],[],['Harlan Coben'],[],2016,Drama Mystery,"['years', 'old', 'Mark', 'Pru', 'Danny', 'Slade', 'park', 'Mark', 'year', 'old', 'brother', 'Jesse', 'annoying', 'mean', 'told', 'lost', 'Jesse', 'ran', 'away', 'gone', 'seen', 'years', 'later', 'Danny', 'detective', 'learns', 'shocking', 'news', 'Jesse', 'DNA', 'found', 'murder', 'scene', 'alive']",Drama Mystery  years old Mark Pru Danny Slade park Mark year old brother Jesse annoying mean told lost Jesse ran away gone seen years later Danny detective learns shocking news Jesse DNA found murder scene alive 6.864  Harlan Coben  ,,
Penny Dreadful: City of Angels,"Rooted in the conflict between characters connected to the deity Santa Muerte and others allied with the Devil, this saga explores an exciting mix of the supernatural and the combustible reality of 1938 Los Angeles, a time and place deeply infused with Mexican-American folklore and social tension.",83685,https://image.tmdb.org/t/p/w500/w8lrENZZBMHTUpXNUlxt81Ks7G2.jpg,6.863,302,False,[],[],['John Logan'],[],2020,Sci-Fi & Fantasy Drama Crime Mystery,"['Rooted', 'conflict', 'characters', 'connected', 'deity', 'Santa', 'Muerte', 'allied', 'Devil', 'saga', 'explores', 'exciting', 'mix', 'supernatural', 'combustible', 'reality', 'Los', 'Angeles', 'time', 'place', 'deeply', 'infused', 'Mexican', 'American', 'folklore', 'social', 'tension']",Sci-Fi & Fantasy Drama Crime Mystery  Rooted conflict characters connected deity Santa Muerte allied Devil saga explores exciting mix supernatural combustible reality Los Angeles time place deeply infused Mexican American folklore social tension 6.863  John Logan  ,,
The Gypsy Bride,"Set in the heart of the Spanish Romani community, the fiction follows police inspector Elena Blanco and her team, as they try to crack the crime case pertaining to the murders of sisters Lara and Susana Macaya, separated by a 7-year gap.",128020,https://image.tmdb.org/t/p/w500/i5dE5ndiFfGxGVkSdW29jbTdulj.jpg,6.857,14,False,[],[],[],[],2022,Crime Mystery Drama,"['Set', 'heart', 'Spanish', 'Romani', 'community', 'fiction', 'follows', 'police', 'inspector', 'Elena', 'Blanco', 'team', 'try', 'crack', 'crime', 'case', 'pertaining', 'murders', 'sisters', 'Lara', 'Susana', 'Macaya', 'separated', 'year', 'gap']",Crime Mystery Drama  Set heart Spanish Romani community fiction follows police inspector Elena Blanco team try crack crime case pertaining murders sisters Lara Susana Macaya separated year gap 6.857    ,,
Wonder Egg Priority,"Ai, a young girl with shut-in tendencies, who tries not to interact with others. She keeps one of her eyes hidden behind her hair. One day, she happens to stop by a deserted arcade, where she meets ""Aka."" Spinning the gacha at their urging, she acquires a ""Wonder Egg,"" and from that moment, her fate begins to change...",111255,https://image.tmdb.org/t/p/w500/7Ief4J2hkBuaKxUzy9fMqUoh9BY.jpg,6.853,68,False,[],[],[],[],2021,Animation Drama Sci-Fi & Fantasy Mystery,"['Ai', 'young', 'girl', 'shut', 'tendencies', 'tries', 'interact', 'keeps', 'eyes', 'hidden', 'hair', 'day', 'happens', 'stop', 'deserted', 'arcade', 'meets', 'Aka', 'Spinning', 'gacha', 'urging', 'acquires', 'Wonder', 'Egg', 'moment', 'fate', 'begins', 'change']",Animation Drama Sci-Fi & Fantasy Mystery  Ai young girl shut tendencies tries interact keeps eyes hidden hair day happens stop deserted arcade meets Aka Spinning gacha urging acquires Wonder Egg moment fate begins change 6.853    ,,
Ace Attorney,"A rookie lawyer Ryuuichi Naruhodou stands up to save his defendants by proving their innocence from unusual cases! Is the defendant guilty or innocent...? Believing his client's innocence Naruhodou stands in court and battles his rival judges. With the word of ""OBJECTION!"" and limited evidence, Naruhodou makes a comeback when all odds are against him and seems like there is nothing more he can do. Don't miss out on the comical episodes between him and his mentor Chihiro Ayasato, assistant Mayoi Ayasato, rival prosecutor Reiji Mitsurugi, and numerous unique characters! The anime also depicts the childhood relationship between Naruhodou and his friends. With the skills inherited from his mentor Naruho reveals the truth!",66103,https://image.tmdb.org/t/p/w500/5iqzzrL2cBVk7km4xjSnm2m8erl.jpg,6.852,27,False,[],[],[],[],2016,Animation Crime Drama Mystery,"['rookie', 'lawyer', 'Ryuuichi', 'Naruhodou', 'stands', 'save', 'defendants', 'proving', 'innocence', 'unusual', 'cases', 'defendant', 'guilty', 'innocent', 'Believing', 'client', 'innocence', 'Naruhodou', 'stands', 'court', 'battles', 'rival', 'judges', 'word', 'OBJECTION', 'limited', 'evidence', 'Naruhodou', 'makes', 'comeback', 'odds', 'like', 'miss', 'comical', 'episodes', 'mentor', 'Chihiro', 'Ayasato', 'assistant', 'Mayoi', 'Ayasato', 'rival', 'prosecutor', 'Reiji', 'Mitsurugi', 'numerous', 'unique', 'characters', 'anime', 'depicts', 'childhood', 'relationship', 'Naruhodou', 'friends', 'skills', 'inherited', 'mentor', 'Naruho', 'reveals', 'truth']",Animation Crime Drama Mystery  rookie lawyer Ryuuichi Naruhodou stands save defendants proving innocence unusual cases defendant guilty innocent Believing client innocence Naruhodou stands court battles rival judges word OBJECTION limited evidence Naruhodou makes comeback odds like miss comical episodes mentor Chihiro Ayasato assistant Mayoi Ayasato rival prosecutor Reiji Mitsurugi numerous unique characters anime depicts childhood relationship Naruhodou friends skills inherited mentor Naruho reveals truth 6.852    ,,
Earth: Final Conflict,"Years ago, the Taelons came to Earth, offering friendship and technology to humanity. But there are those who believe the Taelons have more sinister motives.",2840,https://image.tmdb.org/t/p/w500/xOcw7r57ppfPHdaTIauMnE64Npz.jpg,6.851,77,False,[],[],"['Gene Roddenberry', 'Majel Barrett']",[],1997,Sci-Fi & Fantasy Drama Action & Adventure Mystery,"['Years', 'ago', 'Taelons', 'came', 'Earth', 'offering', 'friendship', 'technology', 'humanity', 'believe', 'Taelons', 'sinister', 'motives']",Sci-Fi & Fantasy Drama Action & Adventure Mystery  Years ago Taelons came Earth offering friendship technology humanity believe Taelons sinister motives 6.851  Gene Roddenberry Majel Barrett  ,,
Fear Itself,A horror/suspense anthology series directed by the biggest horror directors working in feature films.,7143,https://image.tmdb.org/t/p/w500/vlcynm3pJf5tRsyXre9oEnVAEVb.jpg,6.848,151,False,[],[],['Mick Garris'],[],2008,Drama Mystery,"['horror', 'suspense', 'anthology', 'series', 'directed', 'biggest', 'horror', 'directors', 'working', 'feature', 'films']",Drama Mystery  horror suspense anthology series directed biggest horror directors working feature films 6.848  Mick Garris  ,,
.hack,".hack follows several young players as they navigate the vast, mysterious MMORPG known as “The World” – a place, it turns out, that is sometimes impossible to leave.",8864,https://image.tmdb.org/t/p/w500/wNplB2ViLejqtyU76Qz2iv3oZPM.jpg,6.84,25,False,[],[],[],[],2002,Action & Adventure Animation Mystery,"['follows', 'young', 'players', 'navigate', 'vast', 'mysterious', 'MMORPG', 'known', 'World', 'place', 'turns', 'impossible', 'leave']",Action & Adventure Animation Mystery  follows young players navigate vast mysterious MMORPG known World place turns impossible leave 6.84    ,,
