name,overview,id,poster_path,rating,vote_count,adult,director,producer,creator,actors,year_released,genres,keywords,tags,Unnamed: 15,Unnamed: 16
Preacher,"A preacher sets out on a mission to make the almighty himself confess his sin of abandoning the world. With his best friend Cassidy, an alcoholic Irish vampire, his love Tulip, a red blooded gun towing Texan, and the power of genesis, an unholy child born from an angel and a devil, Jesse gives up everything to set the world straight with its creator.",64230,https://image.tmdb.org/t/p/w500/ey1WQajA25E5sFGHSApcqSWUSEc.jpg,7.47,1032,False,[],[],"['Seth Rogen', 'Evan Goldberg', 'Sam Catlin']",[],2016,Sci-Fi & Fantasy Mystery Drama,"['preacher', 'sets', 'mission', 'almighty', 'confess', 'sin', 'abandoning', 'world', 'best', 'friend', 'Cassidy', 'alcoholic', 'Irish', 'vampire', 'love', 'Tulip', 'red', 'blooded', 'gun', 'towing', 'Texan', 'power', 'genesis', 'unholy', 'child', 'born', 'angel', 'devil', 'Jesse', 'gives', 'set', 'world', 'straight', 'creator']",Sci-Fi & Fantasy Mystery Drama  preacher sets mission almighty confess sin abandoning world best friend Cassidy alcoholic Irish vampire love Tulip red blooded gun towing Texan power genesis unholy child born angel devil Jesse gives set world straight creator 7.47  Seth Rogen Evan Goldberg Sam Catlin  ,,
The Undoing,"Grace and Jonathan Fraser are living the only lives they ever wanted. Overnight a chasm opens in their lives: a violent death and a chain of terrible revelations. Left behind in the wake of a spreading and very public disaster, Grace must dismantle one life and create another for her child and her family.",83851,https://image.tmdb.org/t/p/w500/3tDbJxobPN3EI2bBebL6zmusmw5.jpg,7.47,625,False,[],[],['David E. Kelley'],[],2020,Drama Crime Mystery,"['Grace', 'Jonathan', 'Fraser', 'living', 'lives', 'wanted', 'Overnight', 'chasm', 'opens', 'lives', 'violent', 'death', 'chain', 'terrible', 'revelations', 'Left', 'wake', 'spreading', 'public', 'disaster', 'Grace', 'dismantle', 'life', 'create', 'child', 'family']",Drama Crime Mystery  Grace Jonathan Fraser living lives wanted Overnight chasm opens lives violent death chain terrible revelations Left wake spreading public disaster Grace dismantle life create child family 7.47  David E. Kelley  ,,
Humans,In a parallel present where the latest must-have gadget for any busy family is a 'Synth' - a highly-developed robotic servant that's so similar to a real human it's transforming the way we live.,62822,https://image.tmdb.org/t/p/w500/iBjjSGgnjAQBSQGO9pYIh7Gp2PO.jpg,7.465,527,False,[],[],"['Jonathan Brackley', 'Sam Vincent']",[],2015,Sci-Fi & Fantasy Drama Mystery,"['parallel', 'present', 'latest', 'gadget', 'busy', 'family', 'Synth', 'highly', 'developed', 'robotic', 'servant', 'similar', 'real', 'human', 'transforming', 'way', 'live']",Sci-Fi & Fantasy Drama Mystery  parallel present latest gadget busy family Synth highly developed robotic servant similar real human transforming way live 7.465  Jonathan Brackley Sam Vincent  ,,
Night Stalker: The Hunt for a Serial Killer,"Beneath the sunlit glamour of 1985 L.A. lurks a relentlessly evil serial killer. In this true-crime story, two detectives won't rest until they catch him.",114705,https://image.tmdb.org/t/p/w500/fOX6cKsDSCRKrDCk4vWFv2MgzM3.jpg,7.465,268,False,[],[],[],[],2021,Documentary Crime Mystery,"['Beneath', 'sunlit', 'glamour', 'lurks', 'relentlessly', 'evil', 'serial', 'killer', 'true', 'crime', 'story', 'detectives', 'wo', 'rest', 'catch']",Documentary Crime Mystery  Beneath sunlit glamour lurks relentlessly evil serial killer true crime story detectives wo rest catch 7.465    ,,
Sirius the Jaeger,"Imperial Capital, 1930. A strange group of people carrying musical instrument cases landed on Tokyo station. They are called the ""Jaegers"", who came to hunt vampires. Amongst them, there stood a young man with striking serenity and unusual aura. His name is Yuliy, a werewolf whose home village was destroyed by vampires. Yuliy and the Jaegers engage in deadly battle over a mysterious holy arc only known as ""The Arc of Sirius"". What truth awaits them at the end...?",80560,https://image.tmdb.org/t/p/w500/cUd3s6KOOFInJphLS6SFI27z2TA.jpg,7.465,100,False,[],[],[],[],2018,Action & Adventure Mystery Sci-Fi & Fantasy Animation,"['Imperial', 'Capital', 'strange', 'group', 'people', 'carrying', 'musical', 'instrument', 'cases', 'landed', 'Tokyo', 'station', 'called', 'Jaegers', 'came', 'hunt', 'vampires', 'stood', 'young', 'man', 'striking', 'serenity', 'unusual', 'aura', 'Yuliy', 'werewolf', 'home', 'village', 'destroyed', 'vampires', 'Yuliy', 'Jaegers', 'engage', 'deadly', 'battle', 'mysterious', 'holy', 'arc', 'known', 'Arc', 'Sirius', 'truth', 'awaits', 'end']",Action & Adventure Mystery Sci-Fi & Fantasy Animation  Imperial Capital strange group people carrying musical instrument cases landed Tokyo station called Jaegers came hunt vampires stood young man striking serenity unusual aura Yuliy werewolf home village destroyed vampires Yuliy Jaegers engage deadly battle mysterious holy arc known Arc Sirius truth awaits end 7.465    ,,
Absentia,A missing FBI agent reappears six years after being declared dead.,72755,https://image.tmdb.org/t/p/w500/uy236cUbjkG0ncSmNeMz2f2OO9Q.jpg,7.459,295,False,[],[],"['Matthew Cirulnick', 'Gaia Violo']",[],2017,Crime Drama Mystery,"['missing', 'FBI', 'agent', 'reappears', 'years', 'declared', 'dead']",Crime Drama Mystery  missing FBI agent reappears years declared dead 7.459  Matthew Cirulnick Gaia Violo  ,,
Tru Calling,A university graduate working in the city morgue is able to repeat the same day over again to prevent murders or other disasters.,2188,https://image.tmdb.org/t/p/w500/jOqsAwPucH96rUQxZiRNwxd90Yu.jpg,7.457,219,False,[],[],['Jon Harmon Feldman'],[],2003,Sci-Fi & Fantasy Drama Mystery,"['university', 'graduate', 'working', 'city', 'morgue', 'able', 'repeat', 'day', 'prevent', 'murders', 'disasters']",Sci-Fi & Fantasy Drama Mystery  university graduate working city morgue able repeat day prevent murders disasters 7.457  Jon Harmon Feldman  ,,
Black Butler,"In Victorian London, 12-year-old business magnate Ciel Phantomhive thwarts dangers to the queen as he's watched over by his demon butler, Sebastian.",50712,https://image.tmdb.org/t/p/w500/iXGs130TRoUplHf0o86zp9MqAYc.jpg,7.456,148,False,[],[],[],[],2008,Animation Comedy Drama Mystery Sci-Fi & Fantasy,"['Victorian', 'London', 'year', 'old', 'business', 'magnate', 'Ciel', 'Phantomhive', 'thwarts', 'dangers', 'queen', 'watched', 'demon', 'butler', 'Sebastian']",Animation Comedy Drama Mystery Sci-Fi & Fantasy  Victorian London year old business magnate Ciel Phantomhive thwarts dangers queen watched demon butler Sebastian 7.456    ,,
Moonlighting,"After being duped and going bankrupt, model Maddie is convinced by David to become a partner in a detective agency. Together they solve various cases, while getting comfortable with each other.",1998,https://image.tmdb.org/t/p/w500/lrx6v9iD7WWkzkYMCvikvG3DIFp.jpg,7.453,299,False,[],[],['Glenn Gordon Caron'],[],1985,Comedy Drama Mystery,"['duped', 'going', 'bankrupt', 'model', 'Maddie', 'convinced', 'David', 'partner', 'detective', 'agency', 'solve', 'cases', 'getting', 'comfortable']",Comedy Drama Mystery  duped going bankrupt model Maddie convinced David partner detective agency solve cases getting comfortable 7.453  Glenn Gordon Caron  ,,
The Victims' Game,"After discovering his estranged daughter's link to mysterious murders, a forensic detective with Asperger's syndrome risks everything to solve the case.",101146,https://image.tmdb.org/t/p/w500/gGINJfhBDzUNEYx3fUKooSlgITe.jpg,7.453,32,False,[],[],"['David Chuang', 'Chen Kuan-chung']",[],2020,Drama Crime Mystery,"['discovering', 'estranged', 'daughter', 'link', 'mysterious', 'murders', 'forensic', 'detective', 'Asperger', 'syndrome', 'risks', 'solve', 'case']",Drama Crime Mystery  discovering estranged daughter link mysterious murders forensic detective Asperger syndrome risks solve case 7.453  David Chuang Chen Kuan-chung  ,,
Santa Clarita Diet,They're ordinary husband and wife realtors until she undergoes a dramatic change that sends them down a road of death and destruction. In a good way.,69470,https://image.tmdb.org/t/p/w500/5rBjNm2sRubaXKBnU904NInFi7P.jpg,7.447,619,False,[],[],['Victor Fresco'],[],2017,Comedy Mystery,"['ordinary', 'husband', 'wife', 'realtors', 'undergoes', 'dramatic', 'change', 'sends', 'road', 'death', 'destruction', 'good', 'way']",Comedy Mystery  ordinary husband wife realtors undergoes dramatic change sends road death destruction good way 7.447  Victor Fresco  ,,
Grantchester,"In 1953 at the hamlet of Grantchester, Sidney Chambers—a charismatic, charming clergyman—turns investigative vicar when one of his parishioners dies in suspicious circumstances.",61457,https://image.tmdb.org/t/p/w500/5Itrb1x7OiA5A0XUreRuevR1hA6.jpg,7.447,104,False,[],[],['Daisy Coulam'],[],2014,Crime Drama Mystery,"['hamlet', 'Grantchester', 'Sidney', 'Chambers', 'charismatic', 'charming', 'clergyman', 'turns', 'investigative', 'vicar', 'parishioners', 'dies', 'suspicious', 'circumstances']",Crime Drama Mystery  hamlet Grantchester Sidney Chambers charismatic charming clergyman turns investigative vicar parishioners dies suspicious circumstances 7.447  Daisy Coulam  ,,
The Afterparty,"When a high school reunion’s afterparty ends in a stunning death, everyone is a suspect. A detective grills the former classmates one by one, uncovering potential motives as each tells their version of the story—culminating in the shocking truth.",106454,https://image.tmdb.org/t/p/w500/8UgHNgUGjYLTnyIrss1kHoJ8jHg.jpg,7.444,116,False,[],[],['Christopher Miller'],[],2022,Mystery Comedy Crime,"['high', 'school', 'reunion', 'afterparty', 'ends', 'stunning', 'death', 'suspect', 'detective', 'grills', 'classmates', 'uncovering', 'potential', 'motives', 'tells', 'version', 'story', 'culminating', 'shocking', 'truth']",Mystery Comedy Crime  high school reunion afterparty ends stunning death suspect detective grills classmates uncovering potential motives tells version story culminating shocking truth 7.444  Christopher Miller  ,,
Chapelwaite,"In the 1850s, Captain Charles Boone relocates his family of three children to his ancestral home in the small, seemingly sleepy town of Preacher’s Corners, Maine after his wife dies at sea. Charles will soon have to confront the secrets of his family’s sordid history, and fight to end the darkness that has plagued the Boones for generations.",126118,https://image.tmdb.org/t/p/w500/v7Oix3Zkhg3ftRxmLmyDBJc9ycp.jpg,7.433,178,False,[],[],"['Peter Filardi', 'Jason Filardi']",[],2021,Drama Mystery,"['Captain', 'Charles', 'Boone', 'relocates', 'family', 'children', 'ancestral', 'home', 'small', 'seemingly', 'sleepy', 'town', 'Preacher', 'Corners', 'Maine', 'wife', 'dies', 'sea', 'Charles', 'soon', 'confront', 'secrets', 'family', 'sordid', 'history', 'fight', 'end', 'darkness', 'plagued', 'Boones', 'generations']",Drama Mystery  Captain Charles Boone relocates family children ancestral home small seemingly sleepy town Preacher Corners Maine wife dies sea Charles soon confront secrets family sordid history fight end darkness plagued Boones generations 7.433  Peter Filardi Jason Filardi  ,,
Kakegurui Twin,"Determined to climb up the social ladder, Mary Saotome invests everything she has into what her elite high school values most: high stakes gambling.",138183,https://image.tmdb.org/t/p/w500/hc4lqS5sOHZCMoMau3xIdtgzafA.jpg,7.433,60,False,[],[],[],[],2022,Animation Drama Mystery,"['Determined', 'climb', 'social', 'ladder', 'Mary', 'Saotome', 'invests', 'elite', 'high', 'school', 'values', 'high', 'stakes', 'gambling']",Animation Drama Mystery  Determined climb social ladder Mary Saotome invests elite high school values high stakes gambling 7.433    ,,
Trapped,Icelandic crime drama featuring Chief of Police Andri.,64852,https://image.tmdb.org/t/p/w500/bTpSWcEqeTXH7Ipr2XUfGW36n02.jpg,7.422,205,False,[],[],['Baltasar Kormákur'],[],2015,Drama Mystery Crime,"['Icelandic', 'crime', 'drama', 'featuring', 'Chief', 'Police', 'Andri']",Drama Mystery Crime  Icelandic crime drama featuring Chief Police Andri 7.422  Baltasar Kormákur  ,,
The North Water,"Henry Drax is a harpooner and brutish killer whose amorality has been shaped to fit the harshness of his world, who will set sail on a whaling expedition to the Arctic with Patrick Sumner, a disgraced ex-army surgeon who signs up as the ship’s doctor. Hoping to escape the horrors of his past, Sumner finds himself on an ill-fated journey with a murderous psychopath. In search of redemption, his story becomes a harsh struggle for survival in the Arctic wasteland.",86941,https://image.tmdb.org/t/p/w500/9CM0ca8pX1os3SJ24hsIc0nN8ph.jpg,7.422,102,False,[],[],['Andrew Haigh'],[],2021,Drama Mystery,"['Henry', 'Drax', 'harpooner', 'brutish', 'killer', 'amorality', 'shaped', 'fit', 'harshness', 'world', 'set', 'sail', 'whaling', 'expedition', 'Arctic', 'Patrick', 'Sumner', 'disgraced', 'ex', 'army', 'surgeon', 'signs', 'ship', 'doctor', 'Hoping', 'escape', 'horrors', 'past', 'Sumner', 'finds', 'ill', 'fated', 'journey', 'murderous', 'psychopath', 'search', 'redemption', 'story', 'harsh', 'struggle', 'survival', 'Arctic', 'wasteland']",Drama Mystery  Henry Drax harpooner brutish killer amorality shaped fit harshness world set sail whaling expedition Arctic Patrick Sumner disgraced ex army surgeon signs ship doctor Hoping escape horrors past Sumner finds ill fated journey murderous psychopath search redemption story harsh struggle survival Arctic wasteland 7.422  Andrew Haigh  ,,
The Red Door,"Leonardo Cagliostro, a policeman, dies and decides to stay on Earth in order to find out more about the circumstances of his death and to save his wife, Anna, who's in danger.",70858,https://image.tmdb.org/t/p/w500/yBlrWtyTeDpC96yswLhcP2WonwX.jpg,7.421,19,False,[],[],"['Giampiero Rigosi', 'Carlo Lucarelli']",[],2017,Crime Mystery,"['Leonardo', 'Cagliostro', 'policeman', 'dies', 'decides', 'stay', 'Earth', 'order', 'find', 'circumstances', 'death', 'save', 'wife', 'Anna', 'danger']",Crime Mystery  Leonardo Cagliostro policeman dies decides stay Earth order find circumstances death save wife Anna danger 7.421  Giampiero Rigosi Carlo Lucarelli  ,,
Sleepy Hollow,Ichabod Crane is resurrected and pulled two and a half centuries through time to unravel a mystery that dates all the way back to the founding fathers.,50825,https://image.tmdb.org/t/p/w500/ooDWFmGR5foBvLNsX1t30Kv6Dlc.jpg,7.413,927,False,[],[],"['Len Wiseman', 'Alex Kurtzman', 'Roberto Orci', 'Phillip Iscove']",[],2013,Drama Mystery Sci-Fi & Fantasy,"['Ichabod', 'Crane', 'resurrected', 'pulled', 'half', 'centuries', 'time', 'unravel', 'mystery', 'dates', 'way', 'founding', 'fathers']",Drama Mystery Sci-Fi & Fantasy  Ichabod Crane resurrected pulled half centuries time unravel mystery dates way founding fathers 7.413  Len Wiseman Alex Kurtzman Roberto Orci Phillip Iscove  ,,
"Quincy, M.E.","Quincy, M.E. is an American television series from Universal Studios pert in several of the later episodes.",2179,https://image.tmdb.org/t/p/w500/sZ58zg6sU5jKhKiHCzstlokkQ90.jpg,7.404,89,False,[],[],['Glen A. Larson'],[],1976,Crime Drama Mystery,"['Quincy', 'American', 'television', 'series', 'Universal', 'Studios', 'pert', 'later', 'episodes']",Crime Drama Mystery  Quincy American television series Universal Studios pert later episodes 7.404  Glen A. Larson  ,,
Lovejoy,"The adventures of the eponymous Lovejoy, a likeable but roguish antiques dealer based in East Anglia. Within the trade, he has a reputation as a “divvie”, a person with an almost supernatural powers for recognising exceptional items as well as distinguishing genuine antique from clever fakes or forgeries.",4557,https://image.tmdb.org/t/p/w500/u8laLfmd7ZxxIFP3DUaqKnVRMFH.jpg,7.402,41,False,[],[],"['Ian La Frenais', 'John Grant']",[],1986,Comedy Drama Mystery,"['adventures', 'eponymous', 'Lovejoy', 'likeable', 'roguish', 'antiques', 'dealer', 'based', 'East', 'Anglia', 'trade', 'reputation', 'divvie', 'person', 'supernatural', 'powers', 'recognising', 'exceptional', 'items', 'distinguishing', 'genuine', 'antique', 'clever', 'fakes', 'forgeries']",Comedy Drama Mystery  adventures eponymous Lovejoy likeable roguish antiques dealer based East Anglia trade reputation divvie person supernatural powers recognising exceptional items distinguishing genuine antique clever fakes forgeries 7.402  Ian La Frenais John Grant  ,,
Dan Brown's The Lost Symbol,"The early adventures of young Harvard symbologist Robert Langdon, who must solve a series of deadly puzzles to save his kidnapped mentor and thwart a chilling global conspiracy.",120452,https://image.tmdb.org/t/p/w500/rc99fLHeOH4QBROUzAyPeKCvt6T.jpg,7.401,302,False,[],[],"['Jay Beattie', 'Dan Dworkin']",[],2021,Action & Adventure Drama Mystery,"['early', 'adventures', 'young', 'Harvard', 'symbologist', 'Robert', 'Langdon', 'solve', 'series', 'deadly', 'puzzles', 'save', 'kidnapped', 'mentor', 'thwart', 'chilling', 'global', 'conspiracy']",Action & Adventure Drama Mystery  early adventures young Harvard symbologist Robert Langdon solve series deadly puzzles save kidnapped mentor thwart chilling global conspiracy 7.401  Jay Beattie Dan Dworkin  ,,
School Tales the Series,Unspeakable horrors roam the halls of high school in this anthology featuring ghost stories directed by seasoned Thai horror directors.,203502,https://image.tmdb.org/t/p/w500/3OwFUerRIahvfnV7ADcJm8xX5fx.jpg,7.4,58,False,[],[],[],[],2022,Mystery,"['Unspeakable', 'horrors', 'roam', 'halls', 'high', 'school', 'anthology', 'featuring', 'ghost', 'stories', 'directed', 'seasoned', 'Thai', 'horror', 'directors']",Mystery  Unspeakable horrors roam halls high school anthology featuring ghost stories directed seasoned Thai horror directors 7.4    ,,
Jonathan Creek,"Working from his home in a converted windmill, Jonathan Creek is a magician with a natural ability for solving puzzles. He soon puts this ability to the use of solving impossible crimes and mysterious murders.",1895,https://image.tmdb.org/t/p/w500/wLKa7RUDp9dN2gMZBkMxywG8xsw.jpg,7.4,51,False,[],[],['David Renwick'],[],1997,Mystery Comedy Drama,"['Working', 'home', 'converted', 'windmill', 'Jonathan', 'Creek', 'magician', 'natural', 'ability', 'solving', 'puzzles', 'soon', 'puts', 'ability', 'use', 'solving', 'impossible', 'crimes', 'mysterious', 'murders']",Mystery Comedy Drama  Working home converted windmill Jonathan Creek magician natural ability solving puzzles soon puts ability use solving impossible crimes mysterious murders 7.4  David Renwick  ,,
77 Sunset Strip,"Stu Bailey and Jeff Spencer are the wisecracking, womanizing private-detective heroes of this Warner Brothers drama. They work out of an office located at 77 Sunset Strip in Los Angeles, California, right next door to a snazzy restaurant where Kookie works as a valet. The finger-snapping, slang-talking Kookie occasionally helps Stu and Jeff with their cases, and eventually becomes a full-fledged member of the detective agency. Rex Randolph and J.R. Hale also join the firm, and Suzanne is their leggy secretary.",925,https://image.tmdb.org/t/p/w500/uoBZjwv3TPJ7L6ybHlUSZvOhodE.jpg,7.4,19,False,[],[],['Roy Huggins'],[],1958,Crime Drama Mystery,"['Stu', 'Bailey', 'Jeff', 'Spencer', 'wisecracking', 'womanizing', 'private', 'detective', 'heroes', 'Warner', 'Brothers', 'drama', 'work', 'office', 'located', 'Sunset', 'Strip', 'Los', 'Angeles', 'California', 'right', 'door', 'snazzy', 'restaurant', 'Kookie', 'works', 'valet', 'finger', 'snapping', 'slang', 'talking', 'Kookie', 'occasionally', 'helps', 'Stu', 'Jeff', 'cases', 'eventually', 'fledged', 'member', 'detective', 'agency', 'Rex', 'Randolph', 'Hale', 'join', 'firm', 'Suzanne', 'leggy', 'secretary']",Crime Drama Mystery  Stu Bailey Jeff Spencer wisecracking womanizing private detective heroes Warner Brothers drama work office located Sunset Strip Los Angeles California right door snazzy restaurant Kookie works valet finger snapping slang talking Kookie occasionally helps Stu Jeff cases eventually fledged member detective agency Rex Randolph Hale join firm Suzanne leggy secretary 7.4  Roy Huggins  ,,
A Private Affair,"Marina Quiroga, a daring upper-class girl with a detective's soul, sets off to catch the serial killer that has been terrorizing her town with her faithful butler Hector's help.",112321,https://image.tmdb.org/t/p/w500/lmGRZEuIQtArmyGjt6Ay5Y74hk2.jpg,7.4,40,False,[],[],"['Ramón Campos', 'Gema R. Neira', 'Teresa Fernández-Valdés']",[],2022,Comedy Mystery Drama,"['Marina', 'Quiroga', 'daring', 'upper', 'class', 'girl', 'detective', 'soul', 'sets', 'catch', 'serial', 'killer', 'terrorizing', 'town', 'faithful', 'butler', 'Hector', 'help']",Comedy Mystery Drama  Marina Quiroga daring upper class girl detective soul sets catch serial killer terrorizing town faithful butler Hector help 7.4  Ramón Campos Gema R. Neira Teresa Fernández-Valdés  ,,
Father Brown,Father Brown is based on G. K. Chesterton's detective stories about a Catholic priest who doubles as an amateur detective in order to try and solve mysteries.,61511,https://image.tmdb.org/t/p/w500/u8LUC3O1hiEDKP2SFZK68iYqMzl.jpg,7.4,87,False,[],[],"['Tahsin Guner', 'Rachel Flowerday']",[],2013,Drama Crime Mystery,"['Father', 'Brown', 'based', 'Chesterton', 'detective', 'stories', 'Catholic', 'priest', 'doubles', 'amateur', 'detective', 'order', 'try', 'solve', 'mysteries']",Drama Crime Mystery  Father Brown based Chesterton detective stories Catholic priest doubles amateur detective order try solve mysteries 7.4  Tahsin Guner Rachel Flowerday  ,,
Streets of Broken Lights,"Russian detectives unwind the ball of the most intricate and cruel crimes. They are consummate professionals, the best cops in town. Even on the most dangerous missions, this quartet never loses their sense of humor. It is it that helps them find the most incredible ways out of any situation. They uphold the law and emerge victorious.",45937,https://image.tmdb.org/t/p/w500/szNH2weSSwKndvpD06qGcp06Bb8.jpg,7.4,11,False,[],[],[],[],1998,Mystery Action & Adventure Comedy Drama,"['Russian', 'detectives', 'unwind', 'ball', 'intricate', 'cruel', 'crimes', 'consummate', 'professionals', 'best', 'cops', 'town', 'dangerous', 'missions', 'quartet', 'loses', 'sense', 'humor', 'helps', 'find', 'incredible', 'ways', 'situation', 'uphold', 'law', 'emerge', 'victorious']",Mystery Action & Adventure Comedy Drama  Russian detectives unwind ball intricate cruel crimes consummate professionals best cops town dangerous missions quartet loses sense humor helps find incredible ways situation uphold law emerge victorious 7.4    ,,
Ghost Hound,"In an isolated region of Kyushu lies the town of Suiten. Though seeming small and modest, Suiten is not a picturesque place for a vacation, unless it is from the “Unseen World”. Taro, Makoto and Masayuki, three boys with traumatic pasts, learn to let their souls cross between the two parallel worlds. However, the Unseen World is no mere copy of the real Apparent World. The Unseen World is the home of ghosts, but changes are now allowing the souls of the dead to pass over into the Apparent World, with unpredictable effects. Follow the journey of Taro, Makoto and Masayuki, as they cross between the two worlds, trying to unravel a great mystery.",36024,https://image.tmdb.org/t/p/w500/mebvYDOMnnadzDDbJOdjQRnap63.jpg,7.4,13,False,[],[],[],[],2007,Animation Drama Mystery Sci-Fi & Fantasy,"['isolated', 'region', 'Kyushu', 'lies', 'town', 'Suiten', 'small', 'modest', 'Suiten', 'picturesque', 'place', 'vacation', 'Unseen', 'World', 'Taro', 'Makoto', 'Masayuki', 'boys', 'traumatic', 'pasts', 'learn', 'let', 'souls', 'cross', 'parallel', 'worlds', 'Unseen', 'World', 'mere', 'copy', 'real', 'Apparent', 'World', 'Unseen', 'World', 'home', 'ghosts', 'changes', 'allowing', 'souls', 'dead', 'pass', 'Apparent', 'World', 'unpredictable', 'effects', 'Follow', 'journey', 'Taro', 'Makoto', 'Masayuki', 'cross', 'worlds', 'trying', 'unravel', 'great', 'mystery']",Animation Drama Mystery Sci-Fi & Fantasy  isolated region Kyushu lies town Suiten small modest Suiten picturesque place vacation Unseen World Taro Makoto Masayuki boys traumatic pasts learn let souls cross parallel worlds Unseen World mere copy real Apparent World Unseen World home ghosts changes allowing souls dead pass Apparent World unpredictable effects Follow journey Taro Makoto Masayuki cross worlds trying unravel great mystery 7.4    ,,
