name,overview,id,poster_path,rating,vote_count,adult,director,producer,creator,actors,year_released,genres,keywords,tags,Unnamed: 15,Unnamed: 16
Scream Queens,The super-charged comedy-horror series is a modern take on the classic whodunit with a killer cast. ,62046,https://image.tmdb.org/t/p/w500/yeayXZYSU8xdmC8i5g5jTdxeggp.jpg,7.9,1622,False,[],[],"['Ryan Murphy', 'Ian Brennan', 'Dante Di Loreto', 'Brad Falchuk']",[],2015,Mystery Crime Comedy,"['super', 'charged', 'comedy', 'horror', 'series', 'modern', 'classic', 'whodunit', 'killer', 'cast']",Mystery Crime Comedy  super charged comedy horror series modern classic whodunit killer cast 7.9  Ryan Murphy Ian Brennan Dante Di Loreto Brad Falchuk  ,,
Kakegurui,"Children from influential families in politics and businesses attend the Hyakkaou Private Academy. There, the hierarchy of the students are classified by a series of games. Students that win the games are on the ruling side and the students who lose become slaves. One day, a mysterious girl, Yumeko Jabami (Minami Hamabe), is transferred to Hyakkaou Private Academy. She looks pure and pretty, but she is actually a compulsive gambler and seeks out the thrill of taking calculated risks.",76409,https://image.tmdb.org/t/p/w500/iLrKRd4z9AwFNhnfpB6LpRctW7L.jpg,7.9,165,False,[],[],[],[],2018,Drama Mystery,"['Children', 'influential', 'families', 'politics', 'businesses', 'attend', 'Hyakkaou', 'Private', 'Academy', 'hierarchy', 'students', 'classified', 'series', 'games', 'Students', 'win', 'games', 'ruling', 'students', 'lose', 'slaves', 'day', 'mysterious', 'girl', 'Yumeko', 'Jabami', 'Minami', 'Hamabe', 'transferred', 'Hyakkaou', 'Private', 'Academy', 'looks', 'pure', 'pretty', 'actually', 'compulsive', 'gambler', 'seeks', 'thrill', 'taking', 'calculated', 'risks']",Drama Mystery  Children influential families politics businesses attend Hyakkaou Private Academy hierarchy students classified series games Students win games ruling students lose slaves day mysterious girl Yumeko Jabami Minami Hamabe transferred Hyakkaou Private Academy looks pure pretty actually compulsive gambler seeks thrill taking calculated risks 7.9    ,,
Ghost Hunt,"Telling ghost stories is a favorite past time of Mai Taniyama and her friends—that is, until she meets 17-year-old Kazuya Shibuya, the man sent by Shibuya Psychic Research Center to investigate paranormal activity at a supposedly haunted school. When Mai gets caught in a dangerous situation, she is rescued by Kazuya's assistant. Saving her lands the assistant incapacitated, and Kazuya demands that Mai become his assistant, instead...",34809,https://image.tmdb.org/t/p/w500/c6NdT9BDcEfIYtL0CmJEtjhVi4.jpg,7.9,31,False,[],[],[],[],2006,Animation Drama Mystery,"['Telling', 'ghost', 'stories', 'favorite', 'past', 'time', 'Mai', 'Taniyama', 'friends', 'meets', 'year', 'old', 'Kazuya', 'Shibuya', 'man', 'sent', 'Shibuya', 'Psychic', 'Research', 'Center', 'investigate', 'paranormal', 'activity', 'supposedly', 'haunted', 'school', 'Mai', 'gets', 'caught', 'dangerous', 'situation', 'rescued', 'Kazuya', 'assistant', 'Saving', 'lands', 'assistant', 'incapacitated', 'Kazuya', 'demands', 'Mai', 'assistant', 'instead']",Animation Drama Mystery  Telling ghost stories favorite past time Mai Taniyama friends meets year old Kazuya Shibuya man sent Shibuya Psychic Research Center investigate paranormal activity supposedly haunted school Mai gets caught dangerous situation rescued Kazuya assistant Saving lands assistant incapacitated Kazuya demands Mai assistant instead 7.9    ,,
Monk,"Adrian Monk was once a rising star with the San Francisco Police Department, legendary for using unconventional means to solve the department's most baffling cases. But after the tragic (and still unsolved) murder of his wife Trudy, he developed an extreme case of obsessive-compulsive disorder. Now working as a private consultant, Monk continues to investigate cases in the most unconventional ways.",1695,https://image.tmdb.org/t/p/w500/3axGMbUecXXOPSeG47v2i9wK5y5.jpg,7.9,906,False,[],[],['Andy Breckman'],[],2002,Comedy Crime Drama Mystery,"['Adrian', 'Monk', 'rising', 'star', 'San', 'Francisco', 'Police', 'Department', 'legendary', 'unconventional', 'means', 'solve', 'department', 'baffling', 'cases', 'tragic', 'unsolved', 'murder', 'wife', 'Trudy', 'developed', 'extreme', 'case', 'obsessive', 'compulsive', 'disorder', 'working', 'private', 'consultant', 'Monk', 'continues', 'investigate', 'cases', 'unconventional', 'ways']",Comedy Crime Drama Mystery  Adrian Monk rising star San Francisco Police Department legendary unconventional means solve department baffling cases tragic unsolved murder wife Trudy developed extreme case obsessive compulsive disorder working private consultant Monk continues investigate cases unconventional ways 7.9  Andy Breckman  ,,
Taboo,Adventurer James Keziah Delaney returns to London from Africa in 1814 along with fourteen stolen diamonds to seek vengeance after the death of his father.,65708,https://image.tmdb.org/t/p/w500/om1wVOuEtwH3krHutIWO9sJzkS5.jpg,7.898,1108,False,[],[],"['Tom Hardy', 'Steven Knight', 'Chips Hardy']",[],2017,Drama Mystery,"['Adventurer', 'James', 'Keziah', 'Delaney', 'returns', 'London', 'Africa', 'fourteen', 'stolen', 'diamonds', 'seek', 'vengeance', 'death', 'father']",Drama Mystery  Adventurer James Keziah Delaney returns London Africa fourteen stolen diamonds seek vengeance death father 7.898  Tom Hardy Steven Knight Chips Hardy  ,,
First Kill,"Falling in love is tricky for teens Juliette and Calliope: One's a vampire, the other's a vampire hunter — and both are ready to make their first kill.",111616,https://image.tmdb.org/t/p/w500/hwSy1vVaRzV70ZvAEsl6FGOHNlH.jpg,7.896,275,False,[],[],['V. E. Schwab'],[],2022,Drama Mystery,"['Falling', 'love', 'tricky', 'teens', 'Juliette', 'Calliope', 'vampire', 'vampire', 'hunter', 'ready', 'kill']",Drama Mystery  Falling love tricky teens Juliette Calliope vampire vampire hunter ready kill 7.896  V. E. Schwab  ,,
Prime Suspect,Highly skilled Detective Inspector Jane Tennison battles to prove herself in a male dominated world.,2583,https://image.tmdb.org/t/p/w500/dkTwajGd46vR4vkLaiROvowDTNc.jpg,7.896,72,False,[],[],['Lynda La Plante'],[],1991,Crime Drama Mystery,"['Highly', 'skilled', 'Detective', 'Inspector', 'Jane', 'Tennison', 'battles', 'prove', 'male', 'dominated', 'world']",Crime Drama Mystery  Highly skilled Detective Inspector Jane Tennison battles prove male dominated world 7.896  Lynda La Plante  ,,
CSI: Vegas,"Facing an existential threat that could bring down the Crime Lab, a brilliant team of forensic investigators must welcome back old friends and deploy new techniques to preserve and serve justice in Sin City.",122194,https://image.tmdb.org/t/p/w500/7x1DwPyjVCFekAj6QBeS6DIOODf.jpg,7.896,227,False,[],[],"['Anthony E. Zuiker', 'Ann Donahue', 'Jason Tracey']",[],2021,Crime Drama Mystery,"['Facing', 'existential', 'threat', 'bring', 'Crime', 'Lab', 'brilliant', 'team', 'forensic', 'investigators', 'welcome', 'old', 'friends', 'deploy', 'new', 'techniques', 'preserve', 'serve', 'justice', 'Sin', 'City']",Crime Drama Mystery  Facing existential threat bring Crime Lab brilliant team forensic investigators welcome old friends deploy new techniques preserve serve justice Sin City 7.896  Anthony E. Zuiker Ann Donahue Jason Tracey  ,,
American Horror Stories,"An anthology series of stand alone episodes delving into horror myths, legends and lore.",113036,https://image.tmdb.org/t/p/w500/8b9FGJ9WhpkeGFOHYgKjPT5AXS6.jpg,7.896,773,False,[],[],"['Ryan Murphy', 'Brad Falchuk']",[],2021,Drama Mystery Sci-Fi & Fantasy,"['anthology', 'series', 'stand', 'episodes', 'delving', 'horror', 'myths', 'legends', 'lore']",Drama Mystery Sci-Fi & Fantasy  anthology series stand episodes delving horror myths legends lore 7.896  Ryan Murphy Brad Falchuk  ,,
Locke & Key,"Three siblings who move into their ancestral estate after their father's gruesome murder discover their new home's magical keys, which must be used in their stand against an evil creature who wants the keys and their powers.",86423,https://image.tmdb.org/t/p/w500/zuxGfRKziGHPogipnEXXykdDmyT.jpg,7.893,1126,False,[],[],"['Carlton Cuse', 'Meredith Averill', 'Aron Eli Coleite']",[],2020,Sci-Fi & Fantasy Drama Mystery,"['siblings', 'ancestral', 'estate', 'father', 'gruesome', 'murder', 'discover', 'new', 'home', 'magical', 'keys', 'stand', 'evil', 'creature', 'wants', 'keys', 'powers']",Sci-Fi & Fantasy Drama Mystery  siblings ancestral estate father gruesome murder discover new home magical keys stand evil creature wants keys powers 7.893  Carlton Cuse Meredith Averill Aron Eli Coleite  ,,
Platinum End,"As his classmates celebrate their middle school graduation, troubled Mirai is mired in darkness. But his battle is just beginning when he receives some salvation from above in the form of an angel. Now Mirai is pitted against 12 other chosen humans in a battle in which the winner becomes the next god of the world. Mirai has an angel in his corner, but he may need to become a devil to survive.",114892,https://image.tmdb.org/t/p/w500/hxL3ZYeS1GYORKGHG9FI0l6QXQF.jpg,7.888,218,False,[],[],[],[],2021,Animation Drama Mystery,"['classmates', 'celebrate', 'middle', 'school', 'graduation', 'troubled', 'Mirai', 'mired', 'darkness', 'battle', 'beginning', 'receives', 'salvation', 'form', 'angel', 'Mirai', 'pitted', 'chosen', 'humans', 'battle', 'winner', 'god', 'world', 'Mirai', 'angel', 'corner', 'need', 'devil', 'survive']",Animation Drama Mystery  classmates celebrate middle school graduation troubled Mirai mired darkness battle beginning receives salvation form angel Mirai pitted chosen humans battle winner god world Mirai angel corner need devil survive 7.888    ,,
Ragnarok,A small Norwegian town experiencing warm winters and violent downpours seems to be headed for another Ragnarök -- unless someone intervenes in time.,91557,https://image.tmdb.org/t/p/w500/37p95Lpe7mfVX86ZcVr7TisAHPn.jpg,7.887,944,False,[],[],"['Adam Price', 'Emilie Lebech Kaae']",[],2020,Sci-Fi & Fantasy Drama Mystery,"['small', 'Norwegian', 'town', 'experiencing', 'warm', 'winters', 'violent', 'downpours', 'headed', 'Ragnarök', 'intervenes', 'time']",Sci-Fi & Fantasy Drama Mystery  small Norwegian town experiencing warm winters violent downpours headed Ragnarök intervenes time 7.887  Adam Price Emilie Lebech Kaae  ,,
Fairy Tail,"Lucy is a 17-year-old girl, who wants to be a full-fledged mage. One day when visiting Harujion Town, she meets Natsu, a young man who gets sick easily by any type of transportation. But Natsu isn't just any ordinary kid, he's a member of one of the world's most infamous mage guilds: Fairy Tail.",46261,https://image.tmdb.org/t/p/w500/h50lj7xO65qafNYZCrfQ7ztkMBD.jpg,7.885,882,False,[],[],[],[],2009,Animation Action & Adventure Comedy Mystery Sci-Fi & Fantasy,"['Lucy', 'year', 'old', 'girl', 'wants', 'fledged', 'mage', 'day', 'visiting', 'Harujion', 'Town', 'meets', 'Natsu', 'young', 'man', 'gets', 'sick', 'easily', 'type', 'transportation', 'Natsu', 'ordinary', 'kid', 'member', 'world', 'infamous', 'mage', 'guilds', 'Fairy', 'Tail']",Animation Action & Adventure Comedy Mystery Sci-Fi & Fantasy  Lucy year old girl wants fledged mage day visiting Harujion Town meets Natsu young man gets sick easily type transportation Natsu ordinary kid member world infamous mage guilds Fairy Tail 7.885    ,,
The Scooby-Doo/Dynomutt Hour,"The Scooby-Doo/Dynomutt Hour is a 60-minute package show produced by Hanna-Barbera Productions in 1976 for ABC Saturday mornings. It marked the first new installments of the cowardly canine since 1973, and contained the following segments: The Scooby-Doo Show and Dynomutt, Dog Wonder.",2150,https://image.tmdb.org/t/p/w500/geO8f6BdJ0E3OcJSzqyS3AakuEx.jpg,7.884,160,False,[],[],"['Ken Spears', 'Joe Ruby']",[],1976,Animation Comedy Family Kids Mystery,"['Scooby', 'Doo', 'Dynomutt', 'Hour', 'minute', 'package', 'produced', 'Hanna', 'Barbera', 'Productions', 'ABC', 'Saturday', 'mornings', 'marked', 'new', 'installments', 'cowardly', 'canine', 'contained', 'following', 'segments', 'Scooby', 'Doo', 'Dynomutt', 'Dog', 'Wonder']",Animation Comedy Family Kids Mystery  Scooby Doo Dynomutt Hour minute package produced Hanna Barbera Productions ABC Saturday mornings marked new installments cowardly canine contained following segments Scooby Doo Dynomutt Dog Wonder 7.884  Ken Spears Joe Ruby  ,,
Terror in Resonance,"In an alternate version of the present, Tokyo has been decimated by a shocking terrorist attack, and the only hint to the identity of the culprit is a bizarre video uploaded to the internet. The police, baffled by this cryptic clue, are powerless to stop the paranoia spreading across the population. While the world searches for a criminal mastermind to blame for this tragedy, two mysterious children - children who shouldn't even exist - masterfully carry out their heinous plan. Cursed to walk through this world with the names Nine and Twelve, the two combine to form ""Sphinx,"" a clandestine entity determine to wake the people from their slumber - and pull the trigger on this world.",61421,https://image.tmdb.org/t/p/w500/smR33J9YTF8RtDbiLeiJIpUbviF.jpg,7.884,345,False,[],[],[],[],2014,Animation Drama Mystery,"['alternate', 'version', 'present', 'Tokyo', 'decimated', 'shocking', 'terrorist', 'attack', 'hint', 'identity', 'culprit', 'bizarre', 'video', 'uploaded', 'internet', 'police', 'baffled', 'cryptic', 'clue', 'powerless', 'stop', 'paranoia', 'spreading', 'population', 'world', 'searches', 'criminal', 'mastermind', 'blame', 'tragedy', 'mysterious', 'children', 'children', 'exist', 'masterfully', 'carry', 'heinous', 'plan', 'Cursed', 'walk', 'world', 'names', 'combine', 'form', 'Sphinx', 'clandestine', 'entity', 'determine', 'wake', 'people', 'slumber', 'pull', 'trigger', 'world']",Animation Drama Mystery  alternate version present Tokyo decimated shocking terrorist attack hint identity culprit bizarre video uploaded internet police baffled cryptic clue powerless stop paranoia spreading population world searches criminal mastermind blame tragedy mysterious children children exist masterfully carry heinous plan Cursed walk world names combine form Sphinx clandestine entity determine wake people slumber pull trigger world 7.884    ,,
"What's New, Scooby-Doo?","Scooby-Doo and the Mystery, Inc. gang are launched into the 21st century, with new mysteries to solve.",652,https://image.tmdb.org/t/p/w500/7sX80eWq4XHvFGUmCg803iifUcG.jpg,7.882,571,False,[],[],['Sander Schwartz'],[],2002,Animation Action & Adventure Mystery,"['Scooby', 'Doo', 'Mystery', 'gang', 'launched', 'century', 'new', 'mysteries', 'solve']",Animation Action & Adventure Mystery  Scooby Doo Mystery gang launched century new mysteries solve 7.882  Sander Schwartz  ,,
Detective Chinatown,Strange crimes occur in Thailand as the ranking for the world's best detective sees a shift. New detectives come into the picture to tackle three difficult cases.,97317,https://image.tmdb.org/t/p/w500/2hZMrhQgofYtcKUqNtkmThYcJEF.jpg,7.882,17,False,[],[],[],[],2020,Drama Comedy Mystery,"['Strange', 'crimes', 'occur', 'Thailand', 'ranking', 'world', 'best', 'detective', 'sees', 'shift', 'New', 'detectives', 'come', 'picture', 'tackle', 'difficult', 'cases']",Drama Comedy Mystery  Strange crimes occur Thailand ranking world best detective sees shift New detectives come picture tackle difficult cases 7.882    ,,
Copycat Killer,"When a spate of grisly murders throws a city into chaos, a tenacious prosecutor must brace for a cat-and-mouse game against a dangerous manipulator.",158876,https://image.tmdb.org/t/p/w500/xSkcZk9bh1wIkP2vpMA47Bdl6UI.jpg,7.88,71,False,[],[],[],[],2023,Mystery Crime Drama,"['spate', 'grisly', 'murders', 'throws', 'city', 'chaos', 'tenacious', 'prosecutor', 'brace', 'cat', 'mouse', 'game', 'dangerous', 'manipulator']",Mystery Crime Drama  spate grisly murders throws city chaos tenacious prosecutor brace cat mouse game dangerous manipulator 7.88    ,,
How to Get Away with Murder,"A sexy, suspense-driven legal thriller about a group of ambitious law students and their brilliant, mysterious criminal defense professor. They become entangled in a murder plot and will shake the entire university and change the course of their lives.",61056,https://image.tmdb.org/t/p/w500/bJs8Y6T88NcgksxA8UaVl4YX8p8.jpg,7.874,1458,False,[],[],['Peter Nowalk'],[],2014,Crime Drama Mystery,"['sexy', 'suspense', 'driven', 'legal', 'thriller', 'group', 'ambitious', 'law', 'students', 'brilliant', 'mysterious', 'criminal', 'defense', 'professor', 'entangled', 'murder', 'plot', 'shake', 'entire', 'university', 'change', 'course', 'lives']",Crime Drama Mystery  sexy suspense driven legal thriller group ambitious law students brilliant mysterious criminal defense professor entangled murder plot shake entire university change course lives 7.874  Peter Nowalk  ,,
The Killing,"The Killing is an American crime drama television series based upon the Danish television series Forbrydelsen. Set in Seattle, Washington, the series follows the various murder investigations by homicide detectives Sarah Linden and Stephen Holder.",34415,https://image.tmdb.org/t/p/w500/mOzYV3QH5Nwm8CwkVIUmb0Ae0IO.jpg,7.869,662,False,[],[],['Veena Sud'],[],2011,Drama Crime Mystery,"['Killing', 'American', 'crime', 'drama', 'television', 'series', 'based', 'Danish', 'television', 'series', 'Forbrydelsen', 'Set', 'Seattle', 'Washington', 'series', 'follows', 'murder', 'investigations', 'homicide', 'detectives', 'Sarah', 'Linden', 'Stephen', 'Holder']",Drama Crime Mystery  Killing American crime drama television series based Danish television series Forbrydelsen Set Seattle Washington series follows murder investigations homicide detectives Sarah Linden Stephen Holder 7.869  Veena Sud  ,,
Luther,"A dark psychological crime drama starring Idris Elba as Luther, a man struggling with his own terrible demons, who might be as dangerous as the depraved murderers he hunts.",1426,https://image.tmdb.org/t/p/w500/hDxOMX8zzH1FiqKWVBzNaYGBkle.jpg,7.868,925,False,[],[],['Neil Cross'],[],2010,Crime Drama Mystery,"['dark', 'psychological', 'crime', 'drama', 'starring', 'Idris', 'Elba', 'Luther', 'man', 'struggling', 'terrible', 'demons', 'dangerous', 'depraved', 'murderers', 'hunts']",Crime Drama Mystery  dark psychological crime drama starring Idris Elba Luther man struggling terrible demons dangerous depraved murderers hunts 7.868  Neil Cross  ,,
Psych,"Thanks to his police officer father's efforts, Shawn Spencer spent his childhood developing a keen eye for detail (and a lasting dislike of his dad). Years later, Shawn's frequent tips to the police lead to him being falsely accused of a crime he solved.

Now, Shawn has no choice but to use his abilities to perpetuate his cover story: psychic crime-solving powers, all the while dragging his best friend, his dad, and the police along for the ride.",1447,https://image.tmdb.org/t/p/w500/fDI15gTVbtW5Sbv5QenqecRxWKJ.jpg,7.864,685,False,[],[],['Steve Franks'],[],2006,Comedy Drama Mystery,"['Thanks', 'police', 'officer', 'father', 'efforts', 'Shawn', 'Spencer', 'spent', 'childhood', 'developing', 'keen', 'eye', 'detail', 'lasting', 'dislike', 'dad', 'Years', 'later', 'Shawn', 'frequent', 'tips', 'police', 'lead', 'falsely', 'accused', 'crime', 'solved', 'Shawn', 'choice', 'use', 'abilities', 'perpetuate', 'cover', 'story', 'psychic', 'crime', 'solving', 'powers', 'dragging', 'best', 'friend', 'dad', 'police', 'ride']",Comedy Drama Mystery  Thanks police officer father efforts Shawn Spencer spent childhood developing keen eye detail lasting dislike dad Years later Shawn frequent tips police lead falsely accused crime solved Shawn choice use abilities perpetuate cover story psychic crime solving powers dragging best friend dad police ride 7.864  Steve Franks  ,,
Money Heist: Korea - Joint Economic Area,"Disguised under the shadows of a mask, a crew of desperados band together under the leadership of a criminal mastermind known only as “The Professor” to pull off the biggest heist Korea has ever seen.",112836,https://image.tmdb.org/t/p/w500/mbsRGqJtdKcVbjQxkrfzKCAkYoU.jpg,7.86,608,False,[],[],"['Kim Hong-sun', 'Ryu Yong-jae', 'Kim Hwan-chae', 'Choi Sung-joon']",[],2022,Action & Adventure Crime Drama Mystery,"['Disguised', 'shadows', 'mask', 'crew', 'desperados', 'band', 'leadership', 'criminal', 'mastermind', 'known', 'Professor', 'pull', 'biggest', 'heist', 'Korea', 'seen']",Action & Adventure Crime Drama Mystery  Disguised shadows mask crew desperados band leadership criminal mastermind known Professor pull biggest heist Korea seen 7.86  Kim Hong-sun Ryu Yong-jae Kim Hwan-chae Choi Sung-joon  ,,
The Alfred Hitchcock Hour,"A continuation of the dramatic anthology series “Alfred Hitchcock Presents”, hosted by the master of suspense and mystery.",21728,https://image.tmdb.org/t/p/w500/1VXTfckVsiNRqhWs9fdozyljuGy.jpg,7.857,49,False,[],[],['Alfred Hitchcock'],[],1962,Crime Mystery Drama,"['continuation', 'dramatic', 'anthology', 'series', 'Alfred', 'Hitchcock', 'Presents', 'hosted', 'master', 'suspense', 'mystery']",Crime Mystery Drama  continuation dramatic anthology series Alfred Hitchcock Presents hosted master suspense mystery 7.857  Alfred Hitchcock  ,,
Linlang,"Victor “Bangis” Lualhati has always been a fighter. As a former boxer, he gets used to overcoming obstacles through tough times. However, when he finds a suspicious message on his wife's phone, he will be faced with a challenge he never saw coming. As Victor investigates, he discovers there is more at play than just a cheating spouse. The deeper he digs, the more shocking realizations he makes.",212884,https://image.tmdb.org/t/p/w500/75w2r273PCnliLdlWu9Vm3NtxTT.jpg,7.857,7,False,[],[],[],[],2023,Mystery Drama,"['Victor', 'Bangis', 'Lualhati', 'fighter', 'boxer', 'gets', 'overcoming', 'obstacles', 'tough', 'times', 'finds', 'suspicious', 'message', 'wife', 'phone', 'faced', 'challenge', 'saw', 'coming', 'Victor', 'investigates', 'discovers', 'play', 'cheating', 'spouse', 'deeper', 'digs', 'shocking', 'realizations', 'makes']",Mystery Drama  Victor Bangis Lualhati fighter boxer gets overcoming obstacles tough times finds suspicious message wife phone faced challenge saw coming Victor investigates discovers play cheating spouse deeper digs shocking realizations makes 7.857    ,,
The Closer,"Deputy Police Chief Brenda Leigh Johnson transfers from Atlanta to LA to head up a special unit of the LAPD that handles sensitive, high-profile murder cases. Johnson's quirky personality and hard-nosed approach often rubs her colleagues the wrong way, but her reputation as one of the world's best interrogator eventually wins over even her toughest critics.",1450,https://image.tmdb.org/t/p/w500/sVE1SSDlXNCBh3sPYkIUTKfxOAk.jpg,7.85,270,False,[],[],"['Michael M. Robin', 'James Duff']",[],2005,Crime Drama Mystery,"['Deputy', 'Police', 'Chief', 'Brenda', 'Leigh', 'Johnson', 'transfers', 'Atlanta', 'LA', 'head', 'special', 'unit', 'LAPD', 'handles', 'sensitive', 'high', 'profile', 'murder', 'cases', 'Johnson', 'quirky', 'personality', 'hard', 'nosed', 'approach', 'rubs', 'colleagues', 'wrong', 'way', 'reputation', 'world', 'best', 'interrogator', 'eventually', 'wins', 'toughest', 'critics']",Crime Drama Mystery  Deputy Police Chief Brenda Leigh Johnson transfers Atlanta LA head special unit LAPD handles sensitive high profile murder cases Johnson quirky personality hard nosed approach rubs colleagues wrong way reputation world best interrogator eventually wins toughest critics 7.85  Michael M. Robin James Duff  ,,
Unforgotten,"London police detectives Cassie Stuart and Sunny Khan investigate historic cold cases involving missing persons, murder and long-hidden secrets.",62505,https://image.tmdb.org/t/p/w500/wll5rUiRvF51Mpyo2CfdLjtjl8f.jpg,7.847,131,False,[],[],['Chris Lang'],[],2015,Drama Crime Mystery,"['London', 'police', 'detectives', 'Cassie', 'Stuart', 'Sunny', 'Khan', 'investigate', 'historic', 'cold', 'cases', 'involving', 'missing', 'persons', 'murder', 'long', 'hidden', 'secrets']",Drama Crime Mystery  London police detectives Cassie Stuart Sunny Khan investigate historic cold cases involving missing persons murder long hidden secrets 7.847  Chris Lang  ,,
