name,overview,id,poster_path,rating,vote_count,adult,director,producer,creator,actors,year_released,genres,keywords,tags,Unnamed: 15,Unnamed: 16
Sister Wives,"Husband Kody Brown, along with his four wives (only one of which is legally married to Kody) and their combined 18 children, attempts to navigate life as a ""normal"" family in a society that shuns their lifestyle.",34045,https://image.tmdb.org/t/p/w500/l0H6tzYgxlaufL7yuRdM6y67sYB.jpg,6.1,46,False,[],[],[],[],2010,Reality Drama,"['Husband', 'Kody', 'Brown', 'wives', 'legally', 'married', 'Kody', 'combined', 'children', 'attempts', 'navigate', 'life', 'normal', 'family', 'society', 'shuns', 'lifestyle']",Reality Drama  Husband Kody Brown wives legally married Kody combined children attempts navigate life normal family society shuns lifestyle 6.1    ,,
Made in Chelsea,"Reality series following the lives, loves and awks of SW3's bright young things.",39148,https://image.tmdb.org/t/p/w500/99xPXLPqKHcNRYq3fCU7GkHQyQI.jpg,6.1,16,False,[],[],[],[],2011,Reality,"['Reality', 'series', 'following', 'lives', 'loves', 'awks', 'bright', 'young', 'things']",Reality  Reality series following lives loves awks bright young things 6.1    ,,
Squid Game: The Challenge,"Immersed in the world of ""Squid Game,"" 456 real players put their skills — and character — to the ultimate test for a life-changing $4.56 million prize.",204082,https://image.tmdb.org/t/p/w500/eAjXAgdjPMZH9Ugub7XYPowFoS1.jpg,6.094,64,False,[],[],[],[],2023,Reality,"['Immersed', 'world', 'Squid', 'Game', 'real', 'players', 'skills', 'character', 'ultimate', 'test', 'life', 'changing', 'million', 'prize']",Reality  Immersed world Squid Game real players skills character ultimate test life changing million prize 6.094    ,,
Are You The One?,"In the most ambitious dating experiment ever attempted, a group of gorgeous single women and guys are put through an extensive and scientific matchmaking process to find their Perfect Match.",61535,https://image.tmdb.org/t/p/w500/q0ffWnsnRiw0NM9bDppksVguxLl.jpg,6.068,44,False,[],[],[],[],2014,Reality,"['ambitious', 'dating', 'experiment', 'attempted', 'group', 'gorgeous', 'single', 'women', 'guys', 'extensive', 'scientific', 'matchmaking', 'process', 'find', 'Perfect', 'Match']",Reality  ambitious dating experiment attempted group gorgeous single women guys extensive scientific matchmaking process find Perfect Match 6.068    ,,
Love Island Australia,"The Australian version of the hit UK's reality show, Love Island. In Mallorca, Spain, 10 Aussie singles will play the ultimate game of love. After finding their match, they must stay together while surviving temptations as new singles enter the villa.",79792,https://image.tmdb.org/t/p/w500/eAOZWC8TjiB0eo4NbtlosBVs89U.jpg,6.018,28,False,[],[],"['Mark Busk-Cowley', 'Brent Baker', 'Tom Gould', 'Joe Scarrat']",[],2018,Reality,"['Australian', 'version', 'hit', 'UK', 'reality', 'Love', 'Island', 'Mallorca', 'Spain', 'Aussie', 'singles', 'play', 'ultimate', 'game', 'love', 'finding', 'match', 'stay', 'surviving', 'temptations', 'new', 'singles', 'enter', 'villa']",Reality  Australian version hit UK reality Love Island Mallorca Spain Aussie singles play ultimate game love finding match stay surviving temptations new singles enter villa 6.018  Mark Busk-Cowley Brent Baker Tom Gould Joe Scarrat  ,,
Bering Sea Gold,"In the frontier town of Nome, Alaska, there’s a gold rush on. But you've never seen gold mining like this before — here, the precious metal isn't found in the ground. It’s sitting in the most unlikely of places: the bottom of the frigid, unpredictable Bering Sea. And there are a handful of people willing to risk it all to bring it to the surface.",58704,https://image.tmdb.org/t/p/w500/jrMvJCbdBEA6UphJhL4kgtmY5Pw.jpg,6.017,30,False,[],[],[],[],2012,Documentary Reality,"['frontier', 'town', 'Nome', 'Alaska', 'gold', 'rush', 'seen', 'gold', 'mining', 'like', 'precious', 'metal', 'found', 'ground', 'sitting', 'unlikely', 'places', 'frigid', 'unpredictable', 'Bering', 'Sea', 'handful', 'people', 'willing', 'risk', 'bring', 'surface']",Documentary Reality  frontier town Nome Alaska gold rush seen gold mining like precious metal found ground sitting unlikely places frigid unpredictable Bering Sea handful people willing risk bring surface 6.017    ,,
The Osbournes,"The Osbournes is an American reality television program featuring the domestic life of heavy metal singer Ozzy Osbourne and his family. The series premiered on MTV on March 5, 2002, and in its first season, was cited as the most-viewed series ever on MTV. The final episode of the series aired March 21, 2005.",499,https://image.tmdb.org/t/p/w500/fxQInFCs47BaNPPRWQqqgZ2qVBk.jpg,6.014,37,False,[],[],[],[],2002,Reality Comedy,"['Osbournes', 'American', 'reality', 'television', 'program', 'featuring', 'domestic', 'life', 'heavy', 'metal', 'singer', 'Ozzy', 'Osbourne', 'family', 'series', 'premiered', 'MTV', 'March', 'season', 'cited', 'viewed', 'series', 'MTV', 'final', 'episode', 'series', 'aired', 'March']",Reality Comedy  Osbournes American reality television program featuring domestic life heavy metal singer Ozzy Osbourne family series premiered MTV March season cited viewed series MTV final episode series aired March 6.014    ,,
Mom's Diary,"How much do you know about your grown up son? In Mom’s Diary, the daily lives of the grown up celebrity sons are closely observed by their mothers. Do you know why your son drinks so much these days? How much do you know about your son’s philosophy in his life style? Heart-warming moments of observational communication between a mother and a son can be seen on Mom’s Diary.",72896,https://image.tmdb.org/t/p/w500/mJuTb1IodtlQa8SjYkvpzX0ylhW.jpg,6.0,5,False,[],[],['Kwak Seung-young'],[],2016,Reality Talk,"['know', 'grown', 'son', 'Mom', 'Diary', 'daily', 'lives', 'grown', 'celebrity', 'sons', 'closely', 'observed', 'mothers', 'know', 'son', 'drinks', 'days', 'know', 'son', 'philosophy', 'life', 'style', 'Heart', 'warming', 'moments', 'observational', 'communication', 'mother', 'son', 'seen', 'Mom', 'Diary']",Reality Talk  know grown son Mom Diary daily lives grown celebrity sons closely observed mothers know son drinks days know son philosophy life style Heart warming moments observational communication mother son seen Mom Diary 6.0  Kwak Seung-young  ,,
The Voice,"The strongest vocalists from across the United states compete in a blockbusters vocal competition, the winner becomes “The Voice.” The show's innovative format features four stages of competition: the blind auditions, the battle rounds, the knockouts and, finally, the live performance shows.",37678,https://image.tmdb.org/t/p/w500/sjtly63wIdTEgdtGvCAOB9AeEyg.jpg,6.0,184,False,[],[],"['John de Mol', 'Roel van Velzen']",[],2011,Reality,"['strongest', 'vocalists', 'United', 'states', 'compete', 'blockbusters', 'vocal', 'competition', 'winner', 'Voice', 'innovative', 'format', 'features', 'stages', 'competition', 'blind', 'auditions', 'battle', 'rounds', 'knockouts', 'finally', 'live', 'performance', 'shows']",Reality  strongest vocalists United states compete blockbusters vocal competition winner Voice innovative format features stages competition blind auditions battle rounds knockouts finally live performance shows 6.0  John de Mol Roel van Velzen  ,,
Hahahahaha - Glad to meet you,Road-type outdoor reality show. The five-kazakhstan tour group takes time out of the busy and trivial daily life to embark on a journey from east to west across China.,112732,https://image.tmdb.org/t/p/w500/vPblPKGOOduCfJA1ZF68b3bf5Xl.jpg,6.0,3,False,[],[],"['Zhengyu Wang', 'Gezhou Chen', '李笑', '陈芸芸']",[],2020,Reality,"['Road', 'type', 'outdoor', 'reality', 'kazakhstan', 'tour', 'group', 'takes', 'time', 'busy', 'trivial', 'daily', 'life', 'embark', 'journey', 'east', 'west', 'China']",Reality  Road type outdoor reality kazakhstan tour group takes time busy trivial daily life embark journey east west China 6.0  Zhengyu Wang Gezhou Chen 李笑 陈芸芸  ,,
Allt för Sverige,"Allt för Sverige is a Swedish reality show based on the original Norwegian format Culture Shock:Norway. The first season of Allt för Sverige premiered on Sveriges Television SVT1 on October 30, 2011, and the last episode aired on December 18, 2011. The series is about Swedish Americans who return to their Swedish roots. In the program, they give the participants more about their families but in each episode one in the group must leave the show and therefore know less about their ancestry.",41947,https://image.tmdb.org/t/p/w500/vISxEPGQFLO37CNImg6aKeL9wmo.jpg,6.0,1,False,[],[],"['David Berner', 'Eric R. Williams']",[],2011,Reality,"['Allt', 'för', 'Sverige', 'Swedish', 'reality', 'based', 'original', 'Norwegian', 'format', 'Culture', 'Shock', 'Norway', 'season', 'Allt', 'för', 'Sverige', 'premiered', 'Sveriges', 'Television', 'October', 'episode', 'aired', 'December', 'series', 'Swedish', 'Americans', 'return', 'Swedish', 'roots', 'program', 'participants', 'families', 'episode', 'group', 'leave', 'know', 'ancestry']",Reality  Allt för Sverige Swedish reality based original Norwegian format Culture Shock Norway season Allt för Sverige premiered Sveriges Television October episode aired December series Swedish Americans return Swedish roots program participants families episode group leave know ancestry 6.0  David Berner Eric R. Williams  ,,
Si on s'aimait,Follow single men and women in a unique experiment to try to break their bad relationship habits and understand why their past experiences have been so unsatisfying. Viewers and contestants alike benefit from the useful advice dispensed by sex therapist Louise Sigouin.,92821,https://image.tmdb.org/t/p/w500/88bWWW5rRHsQmWND0pFs7iocSXo.jpg,6.0,2,False,[],[],"['Anne Boyer', ""Michel D'Astous""]",[],2020,Documentary Reality,"['Follow', 'single', 'men', 'women', 'unique', 'experiment', 'try', 'break', 'bad', 'relationship', 'habits', 'understand', 'past', 'experiences', 'unsatisfying', 'Viewers', 'contestants', 'alike', 'benefit', 'useful', 'advice', 'dispensed', 'sex', 'therapist', 'Louise', 'Sigouin']",Documentary Reality  Follow single men women unique experiment try break bad relationship habits understand past experiences unsatisfying Viewers contestants alike benefit useful advice dispensed sex therapist Louise Sigouin 6.0  Anne Boyer Michel D'Astous  ,,
Mystery at Blind Frog Ranch,"There are some places on earth where the land just seems different, and Blind Frog Ranch in eastern Utah is one of those places. Locals say the land is cursed. That it's trying to hold on to something.",115773,https://image.tmdb.org/t/p/w500/1zSAWZ8LVD3oOmWV8d9PtM6931Y.jpg,6.0,7,False,[],[],[],[],2021,Reality Documentary,"['places', 'earth', 'land', 'different', 'Blind', 'Frog', 'Ranch', 'eastern', 'Utah', 'places', 'Locals', 'land', 'cursed', 'trying', 'hold']",Reality Documentary  places earth land different Blind Frog Ranch eastern Utah places Locals land cursed trying hold 6.0    ,,
Camp kulinaris,10 celebrities move into Camp Kulinaris. Here they will live and work together while running their very own restaurant under the direction of master chef Kjartan Skjelde.,99785,https://image.tmdb.org/t/p/w500/ljpCOB4ROQpSAEYGg5FBwM8QYjv.jpg,6.0,1,False,[],[],[],[],2018,Reality,"['celebrities', 'Camp', 'Kulinaris', 'live', 'work', 'running', 'restaurant', 'direction', 'master', 'chef', 'Kjartan', 'Skjelde']",Reality  celebrities Camp Kulinaris live work running restaurant direction master chef Kjartan Skjelde 6.0    ,,
The Zone: Survival Mission,"This brand new mystery variety show that has only one rule: ""Survive, no matter what"". For each mission, cast members will enter an unknown, virtual reality space through a secret door. No matter what reality they face through the door, they must endure and survive.",158900,https://image.tmdb.org/t/p/w500/tAybRjp5xdhOlyC8BlKCUNqCTN8.jpg,6.0,9,False,[],[],['Jo Hyo-jin'],[],2022,Reality Comedy,"['brand', 'new', 'mystery', 'variety', 'rule', 'Survive', 'matter', 'mission', 'cast', 'members', 'enter', 'unknown', 'virtual', 'reality', 'space', 'secret', 'door', 'matter', 'reality', 'face', 'door', 'endure', 'survive']",Reality Comedy  brand new mystery variety rule Survive matter mission cast members enter unknown virtual reality space secret door matter reality face door endure survive 6.0  Jo Hyo-jin  ,,
Adventure by Accident,"Kian84 chose his own way to find his real self as he found himself having burnout and being stuck in a rut as he's been living the same life for over ten years. By a happy coincidence, Kian84 travels to South America, the other side of the world, with just a backpack with him. Joining him are Actor Lee Si Eon, who showed wonderful bromance in Home Alone, and Pani Bottle, a YouTuber who has over 1.36 million subscribers. Stay tuned to their unpredictable travelog in South America!",216150,https://image.tmdb.org/t/p/w500/fc2BhqzcGPRZJFUX0qpHjQg0LOb.jpg,6.0,3,False,[],[],[],[],2022,Reality,"['chose', 'way', 'find', 'real', 'self', 'found', 'having', 'burnout', 'stuck', 'rut', 'living', 'life', 'years', 'happy', 'coincidence', 'travels', 'South', 'America', 'world', 'backpack', 'Joining', 'Actor', 'Lee', 'Si', 'Eon', 'showed', 'wonderful', 'bromance', 'Home', 'Pani', 'Bottle', 'YouTuber', 'million', 'subscribers', 'Stay', 'tuned', 'unpredictable', 'travelog', 'South', 'America']",Reality  chose way find real self found having burnout stuck rut living life years happy coincidence travels South America world backpack Joining Actor Lee Si Eon showed wonderful bromance Home Pani Bottle YouTuber million subscribers Stay tuned unpredictable travelog South America 6.0    ,,
Come Dine With Me Mexico,Sixteen Mexican celebrities open their homes and prepare a dinner in which they will show who is the best host.,203326,https://image.tmdb.org/t/p/w500/uAhwKdHnkA7aHkY7x3YWOnvKnly.jpg,6.0,2,False,[],[],[],[],2022,Reality,"['Sixteen', 'Mexican', 'celebrities', 'open', 'homes', 'prepare', 'dinner', 'best', 'host']",Reality  Sixteen Mexican celebrities open homes prepare dinner best host 6.0    ,,
Allsång på Skansen,"Allsång på Skansen is a Swedish tv show held at Skansen, Stockholm, every summer on Tuesdays. The audience is supposed to sing-along with musical guests to well-known Swedish songs. The show started in 1935 on a small scale - about fifty people in the audience. Today about 10 000–25 500 people come to each performance.",5177,https://image.tmdb.org/t/p/w500/kH2yVUwYMG4vT42qd6B20m44TDo.jpg,6.0,2,False,[],[],[],[],1979,Family Reality,"['Allsång', 'på', 'Skansen', 'Swedish', 'tv', 'held', 'Skansen', 'Stockholm', 'summer', 'Tuesdays', 'audience', 'supposed', 'sing', 'musical', 'guests', 'known', 'Swedish', 'songs', 'started', 'small', 'scale', 'people', 'audience', 'Today', 'people', 'come', 'performance']",Family Reality  Allsång på Skansen Swedish tv held Skansen Stockholm summer Tuesdays audience supposed sing musical guests known Swedish songs started small scale people audience Today people come performance 6.0    ,,
Chidemaneh,A large Iranian competition in the field of interior design and home decoration with the aim of supporting businesses and improving the level of knowledge of the society in the field of interior decoration and...,234161,https://image.tmdb.org/t/p/w500/t2Nc6mSLD2CSpUzQxIYE42qj1bj.jpg,6.0,1,False,[],[],['Seyed Javad Hashemi'],[],2023,Reality Comedy Talk Family,"['large', 'Iranian', 'competition', 'field', 'interior', 'design', 'home', 'decoration', 'aim', 'supporting', 'businesses', 'improving', 'level', 'knowledge', 'society', 'field', 'interior', 'decoration']",Reality Comedy Talk Family  large Iranian competition field interior design home decoration aim supporting businesses improving level knowledge society field interior decoration 6.0  Seyed Javad Hashemi  ,,
Secret Celebrity RuPaul's Drag Race,"Secret celebrities - from all walks of life - compete in full drag as they try to impress Emmy Award winning host, RuPaul. To save themselves from elimination, they have to lip sync for their lives. In the end, one celebrity will be crowned America's Next Celebrity Drag Superstar.",98888,https://image.tmdb.org/t/p/w500/n2BFhtVyc5Guwvw6qa6LaeuRhMk.jpg,5.963,27,False,[],[],['RuPaul'],[],2020,Reality Drama Talk Comedy,"['Secret', 'celebrities', 'walks', 'life', 'compete', 'drag', 'try', 'impress', 'Emmy', 'Award', 'winning', 'host', 'RuPaul', 'save', 'elimination', 'lip', 'sync', 'lives', 'end', 'celebrity', 'crowned', 'America', 'Celebrity', 'Drag', 'Superstar']",Reality Drama Talk Comedy  Secret celebrities walks life compete drag try impress Emmy Award winning host RuPaul save elimination lip sync lives end celebrity crowned America Celebrity Drag Superstar 5.963  RuPaul  ,,
Dancing with the Stars,"The competition sees celebrities perform choreographed dance routines which are judged by a panel of renowned ballroom experts and voted on by viewers. Enjoy sizzling salsas, sambas and spray-tans as they vie for the coveted Mirrorball Trophy.",1508,https://image.tmdb.org/t/p/w500/xoLzfI4HJtpp6a01zsJlBuxJEQt.jpg,5.9,88,False,[],[],[],[],2005,Family Reality,"['competition', 'sees', 'celebrities', 'perform', 'choreographed', 'dance', 'routines', 'judged', 'panel', 'renowned', 'ballroom', 'experts', 'voted', 'viewers', 'Enjoy', 'sizzling', 'salsas', 'sambas', 'spray', 'tans', 'vie', 'coveted', 'Mirrorball', 'Trophy']",Family Reality  competition sees celebrities perform choreographed dance routines judged panel renowned ballroom experts voted viewers Enjoy sizzling salsas sambas spray tans vie coveted Mirrorball Trophy 5.9    ,,
Ax Men,"Danger is a full-time job for these brave men who put everything on the line each and every day to retrieve the Pacific Northwest timber with which we build our country. Snapped cables, runaway logs and razor-sharp chainsaws are just some of the dangers that threaten their lives daily. Even with new technology that should make the job easier, anything and everything can and does go wrong.",15563,https://image.tmdb.org/t/p/w500/nnkwFrsyP1fXhSl1L2UMsEK2K3l.jpg,5.864,11,False,[],[],[],[],2008,Reality,"['Danger', 'time', 'job', 'brave', 'men', 'line', 'day', 'retrieve', 'Pacific', 'Northwest', 'timber', 'build', 'country', 'Snapped', 'cables', 'runaway', 'logs', 'razor', 'sharp', 'chainsaws', 'dangers', 'threaten', 'lives', 'daily', 'new', 'technology', 'job', 'easier', 'wrong']",Reality  Danger time job brave men line day retrieve Pacific Northwest timber build country Snapped cables runaway logs razor sharp chainsaws dangers threaten lives daily new technology job easier wrong 5.864    ,,
Pimp My Ride,"Pimp My Ride is a TV show produced by MTV. Each episode consists of taking one car in poor condition and restoring it, as well as customizing it. The original American version was hosted by rapper Xzibit. Recently, MTV2 has begun airing episodes from Pimp My Ride UK hosted by DJ Tim Westwood, which features cars being customised in the UK, and Pimp My Ride International, featuring cars in central Europe, hosted by hip hop artists Fat Joe and Lil' Jon, as well as the related CMT series Trick My Truck.",1976,https://image.tmdb.org/t/p/w500/kF0DWjx3MfYRncPGSBoaL41StPe.jpg,5.812,77,False,[],[],"['Bruce Beresford-Redman', 'Rick Hurvitz']",[],2004,Reality,"['Pimp', 'Ride', 'TV', 'produced', 'MTV', 'episode', 'consists', 'taking', 'car', 'poor', 'condition', 'restoring', 'customizing', 'original', 'American', 'version', 'hosted', 'rapper', 'Xzibit', 'Recently', 'begun', 'airing', 'episodes', 'Pimp', 'Ride', 'UK', 'hosted', 'DJ', 'Tim', 'Westwood', 'features', 'cars', 'customised', 'UK', 'Pimp', 'Ride', 'International', 'featuring', 'cars', 'central', 'Europe', 'hosted', 'hip', 'hop', 'artists', 'Fat', 'Joe', 'Lil', 'Jon', 'related', 'CMT', 'series', 'Trick', 'Truck']",Reality  Pimp Ride TV produced MTV episode consists taking car poor condition restoring customizing original American version hosted rapper Xzibit Recently begun airing episodes Pimp Ride UK hosted DJ Tim Westwood features cars customised UK Pimp Ride International featuring cars central Europe hosted hip hop artists Fat Joe Lil Jon related CMT series Trick Truck 5.812  Bruce Beresford-Redman Rick Hurvitz  ,,
90 Day Fiancé: Pillow Talk,Previous cast members of 90 Day Fiancé and its spin-off shows react to new episodes of these shows.,94009,https://image.tmdb.org/t/p/w500/hLDJhb3u9gxMPxLY6aveLtgt7.jpg,5.8,6,False,[],[],[],[],2019,Reality,"['Previous', 'cast', 'members', 'Day', 'Fiancé', 'spin', 'shows', 'react', 'new', 'episodes', 'shows']",Reality  Previous cast members Day Fiancé spin shows react new episodes shows 5.8    ,,
Celebrity Jeopardy!,Celebrity contestants compete for a chance to win money for a charity of their choice.,209752,https://image.tmdb.org/t/p/w500/vhll3DMjzU5xs94BqFl1aYp1DSc.jpg,5.8,5,False,[],[],[],[],2022,Reality,"['Celebrity', 'contestants', 'compete', 'chance', 'win', 'money', 'charity', 'choice']",Reality  Celebrity contestants compete chance win money charity choice 5.8    ,,
I'm a Celebrity...Get Me Out of Here!,"Twelve celebrities are abandoned in the Australian jungle. In order to earn food, they must perform Bushtucker Trials which challenge them physically and mentally.",30901,https://image.tmdb.org/t/p/w500/qhX2AryYKi5zgeKYIJCHsA9l8JC.jpg,5.8,37,False,[],[],[],[],2002,Comedy Reality,"['celebrities', 'abandoned', 'Australian', 'jungle', 'order', 'earn', 'food', 'perform', 'Bushtucker', 'Trials', 'challenge', 'physically', 'mentally']",Comedy Reality  celebrities abandoned Australian jungle order earn food perform Bushtucker Trials challenge physically mentally 5.8    ,,
Fear Factor,Competition reality series in which contestants must decide if they have the guts and determination to face their fears while outpacing the competition.,320,https://image.tmdb.org/t/p/w500/A9FxroNWtOxiApMPxOHbZUWJoaB.jpg,5.8,62,False,[],[],[],[],2001,Reality,"['Competition', 'reality', 'series', 'contestants', 'decide', 'guts', 'determination', 'face', 'fears', 'outpacing', 'competition']",Reality  Competition reality series contestants decide guts determination face fears outpacing competition 5.8    ,,
"Location, Location, Location",This reality show follows Kirstie Allsopp and Phil Spencer as they try to find the perfect home for a different set of buyers each week.,4151,https://image.tmdb.org/t/p/w500/pzNVWR0p51R1MCZHfk8ZVBXBxkU.jpg,5.8,4,False,[],[],[],[],2000,Reality,"['reality', 'follows', 'Kirstie', 'Allsopp', 'Phil', 'Spencer', 'try', 'find', 'perfect', 'home', 'different', 'set', 'buyers', 'week']",Reality  reality follows Kirstie Allsopp Phil Spencer try find perfect home different set buyers week 5.8    ,,
30 Minute Meals,"30 Minute Meals is a Food Network show hosted by Rachael Ray. Her first of four shows on Food Network debuted in the fall of 2001. The show specializes in convenience cooking for those with little time to cook. The show is recorded live-to-tape, with Ray doing almost all preparation in real time. The show was awarded an Emmy for Best Daytime Service Show in 2006.

A common feature on the program is the creation of new versions of classic dishes, some of which are traditionally slow to cook. Ray focuses on creating meals in less than 30 minutes. Ray has also done two specials with the title Thanksgiving in 60, based around the idea of a one-hour Thanksgiving dinner.

Each episode Ray opens the show by saying ""Hi there, I'm Rachael Ray and I make 30-minute meals. Now that means in the time it takes you to watch this program, I will have made a delicious and healthy meal from start to finish.""",2123,https://image.tmdb.org/t/p/w500/vBRtcopj1oobzHc3q7Sa8ag86D9.jpg,5.8,4,False,[],[],[],[],2001,Reality,"['Minute', 'Meals', 'Food', 'Network', 'hosted', 'Rachael', 'Ray', 'shows', 'Food', 'Network', 'debuted', 'fall', 'specializes', 'convenience', 'cooking', 'little', 'time', 'cook', 'recorded', 'live', 'tape', 'Ray', 'preparation', 'real', 'time', 'awarded', 'Emmy', 'Best', 'Daytime', 'Service', 'common', 'feature', 'program', 'creation', 'new', 'versions', 'classic', 'dishes', 'traditionally', 'slow', 'cook', 'Ray', 'focuses', 'creating', 'meals', 'minutes', 'Ray', 'specials', 'title', 'Thanksgiving', 'based', 'idea', 'hour', 'Thanksgiving', 'dinner', 'episode', 'Ray', 'opens', 'saying', 'Hi', 'Rachael', 'Ray', 'minute', 'meals', 'means', 'time', 'takes', 'watch', 'program', 'delicious', 'healthy', 'meal', 'start', 'finish']",Reality  Minute Meals Food Network hosted Rachael Ray shows Food Network debuted fall specializes convenience cooking little time cook recorded live tape Ray preparation real time awarded Emmy Best Daytime Service common feature program creation new versions classic dishes traditionally slow cook Ray focuses creating meals minutes Ray specials title Thanksgiving based idea hour Thanksgiving dinner episode Ray opens saying Hi Rachael Ray minute meals means time takes watch program delicious healthy meal start finish 5.8    ,,
Risqué Business: Japan,"Shin Dong-youp and Sung Si-kyung dive into adult entertainment in Japan, meeting people from all walks of life to demystify the ""taboo"" experience.",224229,https://image.tmdb.org/t/p/w500/oJIpfDELO2MKOZE7dx1ZuWITicR.jpg,5.8,5,False,[],[],[],[],2023,Reality,"['Shin', 'Dong', 'youp', 'Sung', 'Si', 'kyung', 'dive', 'adult', 'entertainment', 'Japan', 'meeting', 'people', 'walks', 'life', 'demystify', 'taboo', 'experience']",Reality  Shin Dong youp Sung Si kyung dive adult entertainment Japan meeting people walks life demystify taboo experience 5.8    ,,
