name,overview,id,poster_path,rating,vote_count,adult,director,producer,creator,actors,year_released,genres,keywords,tags,Unnamed: 15,Unnamed: 16
Die Geissens – Eine schrecklich glamouröse Familie,The Geisses - A Terribly Glamorous Family is a television programme starring the millionaire family Robert and Carmen Geiss.,46001,https://image.tmdb.org/t/p/w500/ufJok54jZlYfs6OvqTSQTQl0VGe.jpg,7.7,3,False,[],[],['Florian Reinhardt'],[],2011,Reality,"['Geisses', 'Terribly', 'Glamorous', 'Family', 'television', 'programme', 'starring', 'millionaire', 'family', 'Robert', 'Carmen', 'Geiss']",Reality  Geisses Terribly Glamorous Family television programme starring millionaire family Robert Carmen Geiss 7.7  Florian Reinhardt  ,,
WWE Main Event,WWE Main Event is a professional wrestling television program produced by WWE that airs on the Ion Television network and streams on Hulu Plus in the United States. The show features WWE wrestlers and complements WWE's primary programs Raw and SmackDown.,46707,https://image.tmdb.org/t/p/w500/dFBJvUjDNYdYTU5TByakm2ED7i6.jpg,7.7,35,False,[],[],['Vince McMahon'],[],2012,Action & Adventure Drama Reality,"['WWE', 'Main', 'Event', 'professional', 'wrestling', 'television', 'program', 'produced', 'WWE', 'airs', 'Ion', 'Television', 'network', 'streams', 'Hulu', 'Plus', 'United', 'States', 'features', 'WWE', 'wrestlers', 'complements', 'WWE', 'primary', 'programs', 'Raw', 'SmackDown']",Action & Adventure Drama Reality  WWE Main Event professional wrestling television program produced WWE airs Ion Television network streams Hulu Plus United States features WWE wrestlers complements WWE primary programs Raw SmackDown 7.7  Vince McMahon  ,,
Terrace House: Opening New Doors,"The bright young people of Terrace House return to Japan, where they live together and face new relationship challenges.",75814,https://image.tmdb.org/t/p/w500/7FJboauhE3x5urYVTmL9YG3fxg7.jpg,7.7,23,False,[],[],[],[],2017,Reality,"['bright', 'young', 'people', 'Terrace', 'House', 'return', 'Japan', 'live', 'face', 'new', 'relationship', 'challenges']",Reality  bright young people Terrace House return Japan live face new relationship challenges 7.7    ,,
Password,"Password is an American television game show which was created by Bob Stewart for Goodson-Todman Productions. The host was Allen Ludden, who had previously been well known as the host of the G.E. College Bowl.

Password originally aired for 1,555 daytime telecasts each weekday from October 2, 1961 to September 15, 1967 on CBS, along with weekly prime time airings from January 2, 1962 to September 9, 1965 and December 25, 1966 to May 22, 1967. An additional 1,099 daytime shows aired from April 5, 1971 to June 27, 1975 on ABC.

The show's announcers were Jack Clark and Lee Vines on CBS and John Harlan on ABC.

Two revivals later aired on NBC from 1979–1982 and 1984–1989, followed by a prime time version on CBS from 2008–2009.

In 2013, TV Guide ranked it #8 in its list of the 60 greatest game shows ever.",5018,https://image.tmdb.org/t/p/w500/ofxDvvIJi5A0HaChmtK6HT3nOJj.jpg,7.7,3,False,[],[],"['Mark Goodson', 'Bill Todman', 'Bob Stewart']",[],1961,Reality,"['Password', 'American', 'television', 'game', 'created', 'Bob', 'Stewart', 'Goodson', 'Todman', 'Productions', 'host', 'Allen', 'Ludden', 'previously', 'known', 'host', 'College', 'Bowl', 'Password', 'originally', 'aired', 'daytime', 'telecasts', 'weekday', 'October', 'September', 'CBS', 'weekly', 'prime', 'time', 'airings', 'January', 'September', 'December', 'additional', 'daytime', 'shows', 'aired', 'April', 'June', 'ABC', 'announcers', 'Jack', 'Clark', 'Lee', 'Vines', 'CBS', 'John', 'Harlan', 'ABC', 'revivals', 'later', 'aired', 'NBC', 'followed', 'prime', 'time', 'version', 'CBS', 'TV', 'Guide', 'ranked', 'list', 'greatest', 'game', 'shows']",Reality  Password American television game created Bob Stewart Goodson Todman Productions host Allen Ludden previously known host College Bowl Password originally aired daytime telecasts weekday October September CBS weekly prime time airings January September December additional daytime shows aired April June ABC announcers Jack Clark Lee Vines CBS John Harlan ABC revivals later aired NBC followed prime time version CBS TV Guide ranked list greatest game shows 7.7  Mark Goodson Bill Todman Bob Stewart  ,,
Australian Survivor,"Australian Survivor sees 24 tough and tenacious people marooned on a tropical island with little more than the clothes on their backs and the drive to be the sole survivor. Contestants are deprived of basic comforts and must build their own shelter, light their own fires, gather their own food and fend for themselves.",10957,https://image.tmdb.org/t/p/w500/ulldUEaQ3ntInsI7omFYVqd3Zp2.jpg,7.7,17,False,[],[],['Charlie Parsons'],[],2002,Reality,"['Australian', 'Survivor', 'sees', 'tough', 'tenacious', 'people', 'marooned', 'tropical', 'island', 'little', 'clothes', 'backs', 'drive', 'sole', 'survivor', 'Contestants', 'deprived', 'basic', 'comforts', 'build', 'shelter', 'light', 'fires', 'gather', 'food', 'fend']",Reality  Australian Survivor sees tough tenacious people marooned tropical island little clothes backs drive sole survivor Contestants deprived basic comforts build shelter light fires gather food fend 7.7  Charlie Parsons  ,,
RuPaul's Drag Race,"Join RuPaul, the world's most famous drag queen, as the host, mentor and judge for the ultimate in drag queen competitions. The top drag queens in the U.S. will vie for drag stardom as RuPaul, in full glamazon drag, will reign supreme in all judging and eliminations while helping guide the contestants as they prepare for each challenge.",8514,https://image.tmdb.org/t/p/w500/rM31D4ecYfpqUZ6s0o6yoxwK5UG.jpg,7.7,201,False,[],[],['RuPaul'],[],2009,Reality,"['Join', 'RuPaul', 'world', 'famous', 'drag', 'queen', 'host', 'mentor', 'judge', 'ultimate', 'drag', 'queen', 'competitions', 'drag', 'queens', 'vie', 'drag', 'stardom', 'RuPaul', 'glamazon', 'drag', 'reign', 'supreme', 'judging', 'eliminations', 'helping', 'guide', 'contestants', 'prepare', 'challenge']",Reality  Join RuPaul world famous drag queen host mentor judge ultimate drag queen competitions drag queens vie drag stardom RuPaul glamazon drag reign supreme judging eliminations helping guide contestants prepare challenge 7.7  RuPaul  ,,
Show Me The Money,"From newcomers to rappers already loved by many fans, all gather to compete against each other in order to pick the best Hip hop entertainer. The one that receives the most votes from the audience takes it all.",68884,https://image.tmdb.org/t/p/w500/zyzD9DGJWyA3VDMrS6ZzmW61SAd.jpg,7.7,3,False,[],[],['Kyung Hyunju'],[],2012,Reality,"['newcomers', 'rappers', 'loved', 'fans', 'gather', 'compete', 'order', 'pick', 'best', 'Hip', 'hop', 'entertainer', 'receives', 'votes', 'audience', 'takes']",Reality  newcomers rappers loved fans gather compete order pick best Hip hop entertainer receives votes audience takes 7.7  Kyung Hyunju  ,,
Whose Line Is It Anyway?,"Comedian Aisha Tyler hosts this improv comedy show where the actors on the show - Wayne Brady, Colin Mochrie, Ryan Stiles along with a special guest each episode -must put their comedic skills to the test through a series of spontaneous improv games, prompted only by random ideas supplied by the studio audience.",64978,https://image.tmdb.org/t/p/w500/lZM2uqQL0PObXB9fQwU2c1eQ9Ii.jpg,7.7,72,False,[],[],[],[],2013,Reality Comedy,"['Comedian', 'Aisha', 'Tyler', 'hosts', 'improv', 'comedy', 'actors', 'Wayne', 'Brady', 'Colin', 'Mochrie', 'Ryan', 'Stiles', 'special', 'guest', 'episode', 'comedic', 'skills', 'test', 'series', 'spontaneous', 'improv', 'games', 'prompted', 'random', 'ideas', 'supplied', 'studio', 'audience']",Reality Comedy  Comedian Aisha Tyler hosts improv comedy actors Wayne Brady Colin Mochrie Ryan Stiles special guest episode comedic skills test series spontaneous improv games prompted random ideas supplied studio audience 7.7    ,,
Below Deck Mediterranean,Follow crew members living and working aboard a 150’ mega-yacht as it undertakes a charter season in the Mediterranean. Providing unparalleled service to wealthy and uncompromising guests is made even more difficult as the team faces everything from love triangles to seeing fellow crew members shockingly cross the line with guests.,66902,https://image.tmdb.org/t/p/w500/u88QjNj1xyGwnZMtSZjA9jDNNro.jpg,7.7,36,False,[],[],[],[],2016,Reality,"['Follow', 'crew', 'members', 'living', 'working', 'aboard', 'mega', 'yacht', 'undertakes', 'charter', 'season', 'Mediterranean', 'Providing', 'unparalleled', 'service', 'wealthy', 'uncompromising', 'guests', 'difficult', 'team', 'faces', 'love', 'triangles', 'seeing', 'fellow', 'crew', 'members', 'shockingly', 'cross', 'line', 'guests']",Reality  Follow crew members living working aboard mega yacht undertakes charter season Mediterranean Providing unparalleled service wealthy uncompromising guests difficult team faces love triangles seeing fellow crew members shockingly cross line guests 7.7    ,,
Property Brothers,Brothers Jonathan and Drew Scott help home buyers to purchase renovation projects.,35058,https://image.tmdb.org/t/p/w500/ccggWzKxSao1VNaVFJNLkZG96Fb.jpg,7.663,86,False,[],[],[],[],2011,Reality,"['Brothers', 'Jonathan', 'Drew', 'Scott', 'help', 'home', 'buyers', 'purchase', 'renovation', 'projects']",Reality  Brothers Jonathan Drew Scott help home buyers purchase renovation projects 7.663    ,,
Legendary,"Pulling directly from the underground ballroom community, voguing teams (aka ""houses"") must compete in unbelievable balls and showcase sickening fashion in order to achieve ""legendary"" status.",99595,https://image.tmdb.org/t/p/w500/4ZIPELWwcKnR6cG11a6mbn7lc4J.jpg,7.65,20,False,[],[],[],[],2020,Reality,"['Pulling', 'directly', 'underground', 'ballroom', 'community', 'voguing', 'teams', 'aka', 'houses', 'compete', 'unbelievable', 'balls', 'showcase', 'sickening', 'fashion', 'order', 'achieve', 'legendary', 'status']",Reality  Pulling directly underground ballroom community voguing teams aka houses compete unbelievable balls showcase sickening fashion order achieve legendary status 7.65    ,,
La Casa de los Famosos Mexico,La Casa de los Famosos Mexico,226658,https://image.tmdb.org/t/p/w500/uh2NbTkUheENmBlUs7Kwb5EaAXQ.jpg,7.615,74,False,[],[],[],[],2023,Reality,"['La', 'Casa', 'de', 'los', 'Famosos', 'Mexico']",Reality  La Casa de los Famosos Mexico 7.615    ,,
Physical: 100,"In this fierce fitness competition, one hundred contestants in top physical shape compete to claim the honor of best body.",210905,https://image.tmdb.org/t/p/w500/lGXjcx4l31TFMH4gtJ59hE9DZAL.jpg,7.6,86,False,[],[],['Jang Ho-gi'],[],2023,Reality,"['fierce', 'fitness', 'competition', 'contestants', 'physical', 'shape', 'compete', 'claim', 'honor', 'best', 'body']",Reality  fierce fitness competition contestants physical shape compete claim honor best body 7.6  Jang Ho-gi  ,,
Taste the Nation with Padma Lakshmi,"Host Padma Lakshmi takes audiences on a journey across America, exploring the rich and diverse food culture of various immigrant groups, seeking out the people who have so heavily shaped what American food is today.",104201,https://image.tmdb.org/t/p/w500/8IQSs2FZ2YxI9S6xk6k0VKxjfTm.jpg,7.6,6,False,[],[],[],[],2020,Reality,"['Host', 'Padma', 'Lakshmi', 'takes', 'audiences', 'journey', 'America', 'exploring', 'rich', 'diverse', 'food', 'culture', 'immigrant', 'groups', 'seeking', 'people', 'heavily', 'shaped', 'American', 'food', 'today']",Reality  Host Padma Lakshmi takes audiences journey America exploring rich diverse food culture immigrant groups seeking people heavily shaped American food today 7.6    ,,
World War II in HD Colour,"World War II In HD Colour is a 13-episode television documentary miniseries recounting the events of World War II narrated by Robert Powell. The show covers the Western Front, Eastern Front, and the Pacific War. It is on syndication in America on the Military Channel. This series is in full color, combining both original and colorized footage.",42154,https://image.tmdb.org/t/p/w500/1in5DbN4t8a7Osw9hCqWEmNoEZF.jpg,7.6,254,False,[],[],['Jonathan Martin'],[],2009,Documentary Reality War & Politics,"['World', 'War', 'II', 'HD', 'Colour', 'episode', 'television', 'documentary', 'miniseries', 'recounting', 'events', 'World', 'War', 'II', 'narrated', 'Robert', 'Powell', 'covers', 'Western', 'Eastern', 'Pacific', 'War', 'syndication', 'America', 'Military', 'Channel', 'series', 'color', 'combining', 'original', 'colorized', 'footage']",Documentary Reality War & Politics  World War II HD Colour episode television documentary miniseries recounting events World War II narrated Robert Powell covers Western Eastern Pacific War syndication America Military Channel series color combining original colorized footage 7.6  Jonathan Martin  ,,
Family Feud,Two families compete against each other in a contest to name the most popular responses to a survey question posed to 100 people.,1790,https://image.tmdb.org/t/p/w500/bZAEZiw9NOlbMKIAbqJUUigsfid.jpg,7.6,28,False,[],[],"['Mark Goodson', 'Bill Todman']",[],1999,Comedy Reality,"['families', 'compete', 'contest', 'popular', 'responses', 'survey', 'question', 'posed', 'people']",Comedy Reality  families compete contest popular responses survey question posed people 7.6  Mark Goodson Bill Todman  ,,
Sanremo Music Festival,"The Sanremo Music Festival is the most popular Italian song contest and awards, held annually in the town of Sanremo, Imperia, Italy, and consisting of a competition amongst previously unreleased songs. The Festival was the inspiration for the Eurovision Song Contest.",66550,https://image.tmdb.org/t/p/w500/xRLWR3bE9tGuYEX2mHEYP2ATZ4h.jpg,7.6,11,False,[],[],[],[],1951,Family Reality,"['Sanremo', 'Music', 'Festival', 'popular', 'Italian', 'song', 'contest', 'awards', 'held', 'annually', 'town', 'Sanremo', 'Imperia', 'Italy', 'consisting', 'competition', 'previously', 'unreleased', 'songs', 'Festival', 'inspiration', 'Eurovision', 'Song', 'Contest']",Family Reality  Sanremo Music Festival popular Italian song contest awards held annually town Sanremo Imperia Italy consisting competition previously unreleased songs Festival inspiration Eurovision Song Contest 7.6    ,,
Taskmaster Norway,The taskmaster has invited five of Norway's best comedians to solve a number of tasks.,94653,https://image.tmdb.org/t/p/w500/za6GkyaB5TJSMuIU2CczN17IfaP.jpg,7.6,8,False,[],[],['Alexander Holland Jensen'],[],2019,Comedy Reality,"['taskmaster', 'invited', 'Norway', 'best', 'comedians', 'solve', 'number', 'tasks']",Comedy Reality  taskmaster invited Norway best comedians solve number tasks 7.6  Alexander Holland Jensen  ,,
Kitchen Nightmares,"Chef Ramsay attempts to do the impossible: turn one ordinary and empty restaurant into the most popular, sought-after venue in town. There's no time for polite small talk as he embarks on his mission to turn around the fortunes of each restaurant in just one week and save them from their living nightmares.",11294,https://image.tmdb.org/t/p/w500/10XpD4aEOExWcOg9bxCA28NNsMQ.jpg,7.554,139,False,[],[],[],[],2007,Reality,"['Chef', 'Ramsay', 'attempts', 'impossible', 'turn', 'ordinary', 'restaurant', 'popular', 'sought', 'venue', 'town', 'time', 'polite', 'small', 'talk', 'embarks', 'mission', 'turn', 'fortunes', 'restaurant', 'week', 'save', 'living', 'nightmares']",Reality  Chef Ramsay attempts impossible turn ordinary restaurant popular sought venue town time polite small talk embarks mission turn fortunes restaurant week save living nightmares 7.554    ,,
Legends of the Hidden Temple,"In a Temple filled with lost treasures and protected by mysterious Mayan temple guards, six teams of two children compete to retrieve one of the historical artifacts in the Temple by performing physical stunts and answering questions based on history, mythology, and geography. After three elimination rounds, only one team remains, who then earns the right to go through the Temple to retrieve the artifact within three minutes and win a grand prize.",363,https://image.tmdb.org/t/p/w500/jsUpyxfYgatd4UKZKfS6WZlkEhI.jpg,7.526,19,False,[],[],[],[],1993,Reality,"['Temple', 'filled', 'lost', 'treasures', 'protected', 'mysterious', 'Mayan', 'temple', 'guards', 'teams', 'children', 'compete', 'retrieve', 'historical', 'artifacts', 'Temple', 'performing', 'physical', 'stunts', 'answering', 'questions', 'based', 'history', 'mythology', 'geography', 'elimination', 'rounds', 'team', 'remains', 'earns', 'right', 'Temple', 'retrieve', 'artifact', 'minutes', 'win', 'grand', 'prize']",Reality  Temple filled lost treasures protected mysterious Mayan temple guards teams children compete retrieve historical artifacts Temple performing physical stunts answering questions based history mythology geography elimination rounds team remains earns right Temple retrieve artifact minutes win grand prize 7.526    ,,
To the Lake,A grim drama that unfolds against the backdrop of a global catastrophe. An unknown new virus turns Moscow into a city of the dead. Money loses its value and those not yet infected struggle desperately for food and survival.,95202,https://image.tmdb.org/t/p/w500/8zIwJf5rDZU04uj0gS1hlz2m6Ui.jpg,7.523,192,False,[],[],['Yana Vagner'],[],2019,Sci-Fi & Fantasy Drama Action & Adventure Reality,"['grim', 'drama', 'unfolds', 'backdrop', 'global', 'catastrophe', 'unknown', 'new', 'virus', 'turns', 'Moscow', 'city', 'dead', 'Money', 'loses', 'value', 'infected', 'struggle', 'desperately', 'food', 'survival']",Sci-Fi & Fantasy Drama Action & Adventure Reality  grim drama unfolds backdrop global catastrophe unknown new virus turns Moscow city dead Money loses value infected struggle desperately food survival 7.523  Yana Vagner  ,,
The Great British Bake Off,"This British television baking competition selects from amongst its competitors the best amateur baker. The series is credited with reinvigorating interest in baking throughout the UK, and many of its participants, including winners, have gone on to start a career based on baking.",34549,https://image.tmdb.org/t/p/w500/4lkXuLZhxUczr8ufy0tKgSRRYD2.jpg,7.519,81,False,[],[],[],[],2010,Reality,"['British', 'television', 'baking', 'competition', 'selects', 'competitors', 'best', 'amateur', 'baker', 'series', 'credited', 'reinvigorating', 'interest', 'baking', 'UK', 'participants', 'including', 'winners', 'gone', 'start', 'career', 'based', 'baking']",Reality  British television baking competition selects competitors best amateur baker series credited reinvigorating interest baking UK participants including winners gone start career based baking 7.519    ,,
90 Day Fiancé,"Getting through customs is just the beginning. With just 90 days to wed on a fiancé visa, follow international couples as they attempt to overcome cultural barriers and family drama while in search of true love that knows no borders.",61575,https://image.tmdb.org/t/p/w500/wJVDf4ZysdxhoREQIHlOM4phRNp.jpg,7.519,54,False,[],[],[],[],2014,Reality,"['Getting', 'customs', 'beginning', 'days', 'd', 'fiancé', 'visa', 'follow', 'international', 'couples', 'attempt', 'overcome', 'cultural', 'barriers', 'family', 'drama', 'search', 'true', 'love', 'knows', 'borders']",Reality  Getting customs beginning days d fiancé visa follow international couples attempt overcome cultural barriers family drama search true love knows borders 7.519    ,,
Keeping Up with the Kardashians,"A peek inside the exploits and privileged private lives of the blended Kardashian-Jenner family, including sisters Kim, Kourtney and Khloé.",14814,https://image.tmdb.org/t/p/w500/nddXOC8wYpIDv7giLzjjqIg8WDA.jpg,7.503,852,False,[],[],"['Ryan Seacrest', 'Eliot Goldberg']",[],2007,Reality,"['peek', 'inside', 'exploits', 'privileged', 'private', 'lives', 'blended', 'Kardashian', 'Jenner', 'family', 'including', 'sisters', 'Kim', 'Kourtney', 'Khloé']",Reality  peek inside exploits privileged private lives blended Kardashian Jenner family including sisters Kim Kourtney Khloé 7.503  Ryan Seacrest Eliot Goldberg  ,,
Life Below Zero,"Viewers go deep into an Alaskan winter to meet six tough and resilient residents as they try to stay one step ahead of storms and man-eating beasts to make it through to spring. The closest neighbor to Sue Aikens is more than 300 miles away. Eric Salitan subsists solely on what he hunts and forages. Chip and Agnes Hailstone catch fish for currency in bartering for supplies, and Andy and Kate Bassich use their pack of sled dogs for transportation.",60910,https://image.tmdb.org/t/p/w500/8YzzLJnJ2i5EWWMjrImEKNdvxPv.jpg,7.5,36,False,[],[],[],[],2013,Reality Documentary,"['Viewers', 'deep', 'Alaskan', 'winter', 'meet', 'tough', 'resilient', 'residents', 'try', 'stay', 'step', 'ahead', 'storms', 'man', 'eating', 'beasts', 'spring', 'closest', 'neighbor', 'Sue', 'Aikens', 'miles', 'away', 'Eric', 'Salitan', 'subsists', 'solely', 'hunts', 'forages', 'Chip', 'Agnes', 'Hailstone', 'catch', 'fish', 'currency', 'bartering', 'supplies', 'Andy', 'Kate', 'Bassich', 'use', 'pack', 'sled', 'dogs', 'transportation']",Reality Documentary  Viewers deep Alaskan winter meet tough resilient residents try stay step ahead storms man eating beasts spring closest neighbor Sue Aikens miles away Eric Salitan subsists solely hunts forages Chip Agnes Hailstone catch fish currency bartering supplies Andy Kate Bassich use pack sled dogs transportation 7.5    ,,
1 Night 2 Days,"2 Days & 1 Night is a South Korean reality-variety show with the motto ""real wild road variety."" Its main concept is to recommend various places of interest that viewers can visit in South Korea.",30801,https://image.tmdb.org/t/p/w500/fCk6fEIz7wnFtB9weZ9HgpGKYG9.jpg,7.5,21,False,[],[],['Na Young-seok'],[],2007,Comedy Reality,"['Days', 'Night', 'South', 'Korean', 'reality', 'variety', 'motto', 'real', 'wild', 'road', 'variety', 'main', 'concept', 'recommend', 'places', 'interest', 'viewers', 'visit', 'South', 'Korea']",Comedy Reality  Days Night South Korean reality variety motto real wild road variety main concept recommend places interest viewers visit South Korea 7.5  Na Young-seok  ,,
Terrace House: Boys & Girls in the City,"A new set of six men and women start their lives together under one roof. All they get is a fabulous home and a car. As always, there is no script.",66647,https://image.tmdb.org/t/p/w500/nMjIzMTjjio7CIpPuL17f0l6n1o.jpg,7.5,23,False,[],[],[],[],2015,Reality,"['new', 'set', 'men', 'women', 'start', 'lives', 'roof', 'fabulous', 'home', 'car', 'script']",Reality  new set men women start lives roof fabulous home car script 7.5    ,,
X Factor,"X Factor is a successful TV show airing on prime time in Italy. The singing competition is the Italian version of The X Factor franchise. It was hosted until the Season 4 by Francesco Facchinetti, its judges in the first two series were the musical producer Mara Maionchi, TV host Simona Ventura and the singer-songwriter Morgan.",16322,https://image.tmdb.org/t/p/w500/uzzwJ0R0h5MA9C3rt6NhsTjF8PO.jpg,7.5,7,False,[],[],[],[],2008,Reality,"['X', 'Factor', 'successful', 'TV', 'airing', 'prime', 'time', 'Italy', 'singing', 'competition', 'Italian', 'version', 'X', 'Factor', 'franchise', 'hosted', 'Season', 'Francesco', 'Facchinetti', 'judges', 'series', 'musical', 'producer', 'Mara', 'Maionchi', 'TV', 'host', 'Simona', 'Ventura', 'singer', 'songwriter', 'Morgan']",Reality  X Factor successful TV airing prime time Italy singing competition Italian version X Factor franchise hosted Season Francesco Facchinetti judges series musical producer Mara Maionchi TV host Simona Ventura singer songwriter Morgan 7.5    ,,
The Devil's Plan,"It's the ultimate showdown of wits, brains, strategy, and alliances for a chance to win 500 million won.",214582,https://image.tmdb.org/t/p/w500/vNoINLWniSpqS2Qaol4BINX7BSY.jpg,7.5,43,False,[],[],['Jeong Jong-yeon'],[],2023,Reality,"['ultimate', 'showdown', 'wits', 'brains', 'strategy', 'alliances', 'chance', 'win', 'million', 'won']",Reality  ultimate showdown wits brains strategy alliances chance win million won 7.5  Jeong Jong-yeon  ,,
Welcome to Plathville,"The nine flaxen-haired children in the Plath family have never had a soda, don't know who Spiderman or Tom Brady is and have never watched TV, living remotely in rural Georgia with their ""follow their own rules"" parents Kim and Barry Plath.",95574,https://image.tmdb.org/t/p/w500/2vxzApwvpDg71GI6LBIQ7DhxRGm.jpg,7.5,6,False,[],[],[],[],2019,Reality,"['flaxen', 'haired', 'children', 'Plath', 'family', 'soda', 'know', 'Spiderman', 'Tom', 'Brady', 'watched', 'TV', 'living', 'remotely', 'rural', 'Georgia', 'follow', 'rules', 'parents', 'Kim', 'Barry', 'Plath']",Reality  flaxen haired children Plath family soda know Spiderman Tom Brady watched TV living remotely rural Georgia follow rules parents Kim Barry Plath 7.5    ,,
Reality Shore,Reality Shore is the first Swiss and German spin-off of the MTV series Jersey Shore.,153246,https://image.tmdb.org/t/p/w500/9HngiulyXJhNvDLvsh2uPQqtqIT.jpg,7.5,2,False,[],[],[],[],2021,Reality,"['Reality', 'Shore', 'Swiss', 'German', 'spin', 'MTV', 'series', 'Jersey', 'Shore']",Reality  Reality Shore Swiss German spin MTV series Jersey Shore 7.5    ,,
