name,overview,id,poster_path,rating,vote_count,adult,director,producer,creator,actors,year_released,genres,keywords,tags,Unnamed: 15,Unnamed: 16
Street Outlaws vs the World,"The quickest and most polarizing Street Outlaws travel abroad to represent their country. As Team USA, they must face stiff, well-known competition from Australia to prove that they are, in fact, the world’s fastest drivers.",236068,https://image.tmdb.org/t/p/w500/kpwWRjlTHxz69ycDMo2O18uFG1L.jpg,10.0,1,False,[],[],[],[],2023,Reality,"['quickest', 'polarizing', 'Street', 'Outlaws', 'travel', 'abroad', 'represent', 'country', 'Team', 'USA', 'face', 'stiff', 'known', 'competition', 'Australia', 'prove', 'fact', 'world', 'fastest', 'drivers']",Reality  quickest polarizing Street Outlaws travel abroad represent country Team USA face stiff known competition Australia prove fact world fastest drivers 10.0    ,,
Pantaxa Laiya,"Eight sexy ladies will make summer even hotter as they bare it all in this newest reality show. Join them as they undergo physical, mental, sensual and sexual challenges that would shape to be the next Vivamax stars.",224566,https://image.tmdb.org/t/p/w500/7Kjk1XofE6lC0LqWPushmVN3odA.jpg,10.0,1,False,[],[],[],[],2023,Reality,"['sexy', 'ladies', 'summer', 'hotter', 'bare', 'newest', 'reality', 'Join', 'undergo', 'physical', 'mental', 'sensual', 'sexual', 'challenges', 'shape', 'Vivamax', 'stars']",Reality  sexy ladies summer hotter bare newest reality Join undergo physical mental sensual sexual challenges shape Vivamax stars 10.0    ,,
The Voice Brasil,"The Voice Brasil is a current Brazilian reality talent show which premiered on Rede Globo on September 23, 2012. Based on the reality singing competition The Voice of Holland, the series was created by Dutch television producer John de Mol.

The show is currently broadcast on Sunday afternoons, before the traditional Sunday soccer matches, in a total of 13 weekly episodes. The season finale aired on December 16, 2012 with Ellen Oléria as winner.",46299,https://image.tmdb.org/t/p/w500/pixFvlKSz3jRE8LBh6DDhy6mnX6.jpg,10.0,1,False,[],[],"['John de Mol', 'Roel van Velzen']",[],2012,Reality,"['Voice', 'Brasil', 'current', 'Brazilian', 'reality', 'talent', 'premiered', 'Rede', 'Globo', 'September', 'Based', 'reality', 'singing', 'competition', 'Voice', 'Holland', 'series', 'created', 'Dutch', 'television', 'producer', 'John', 'de', 'Mol', 'currently', 'broadcast', 'Sunday', 'afternoons', 'traditional', 'Sunday', 'soccer', 'matches', 'total', 'weekly', 'episodes', 'season', 'finale', 'aired', 'December', 'Ellen', 'Oléria', 'winner']",Reality  Voice Brasil current Brazilian reality talent premiered Rede Globo September Based reality singing competition Voice Holland series created Dutch television producer John de Mol currently broadcast Sunday afternoons traditional Sunday soccer matches total weekly episodes season finale aired December Ellen Oléria winner 10.0  John de Mol Roel van Velzen  ,,
Temptation Island (RO),"Couples, temptations and an island full of traps, these are the key elements of the reality show presented by Radu Vâlcan. In the end, only true love can pass the test, and the couples entering the competition will find out if they are connected only by habit or, on the contrary, by sincere and strong feelings. The ultimate test of love and trust will be given by the couples who will return from Thailand totally changed.",62767,https://image.tmdb.org/t/p/w500/7CqOIzIKaBaIzLQjCIcMynZw5Gd.jpg,10.0,2,False,[],[],"['Emilia Vlad', 'Bogdan Oancea']",[],2015,Reality Drama,"['Couples', 'temptations', 'island', 'traps', 'key', 'elements', 'reality', 'presented', 'Radu', 'Vâlcan', 'end', 'true', 'love', 'pass', 'test', 'couples', 'entering', 'competition', 'find', 'connected', 'habit', 'contrary', 'sincere', 'strong', 'feelings', 'ultimate', 'test', 'love', 'trust', 'given', 'couples', 'return', 'Thailand', 'totally', 'changed']",Reality Drama  Couples temptations island traps key elements reality presented Radu Vâlcan end true love pass test couples entering competition find connected habit contrary sincere strong feelings ultimate test love trust given couples return Thailand totally changed 10.0  Emilia Vlad Bogdan Oancea  ,,
La France a un incroyable Talent,"La France a un incroyable talent, previously known as Incroyable Talent is a French television programme, based on the Got Talent series. It debuted on M6 on 2 November 2006, presented by Alessandra Sublet.",19481,https://image.tmdb.org/t/p/w500/yOMACPYpK1Q1GDaOuo4eVv7hULQ.jpg,10.0,1,False,[],[],"['Ken Warwick', 'Cécile Frot-Coutaz', 'Jason Raff']",[],2006,Reality,"['La', 'France', 'un', 'incroyable', 'talent', 'previously', 'known', 'Incroyable', 'Talent', 'French', 'television', 'programme', 'based', 'Got', 'Talent', 'series', 'debuted', 'November', 'presented', 'Alessandra', 'Sublet']",Reality  La France un incroyable talent previously known Incroyable Talent French television programme based Got Talent series debuted November presented Alessandra Sublet 10.0  Ken Warwick Cécile Frot-Coutaz Jason Raff  ,,
Winter House,"Embark on the ultimate winter getaway with some of Bravo’s beloved Summer House and Southern Charm cast members and their friends during a two-week vacation in Stowe, Vermont. Reach new peaks when this rowdy crew kicks off an epic experience filled with hot tub hookups and snowy shenanigans.",135204,https://image.tmdb.org/t/p/w500/ne73A31j1RfKAJMAWNQr4OuFDUX.jpg,10.0,3,False,[],[],[],[],2021,Reality,"['Embark', 'ultimate', 'winter', 'getaway', 'Bravo', 'beloved', 'Summer', 'House', 'Southern', 'Charm', 'cast', 'members', 'friends', 'week', 'vacation', 'Stowe', 'Vermont', 'Reach', 'new', 'peaks', 'rowdy', 'crew', 'kicks', 'epic', 'experience', 'filled', 'hot', 'tub', 'hookups', 'snowy', 'shenanigans']",Reality  Embark ultimate winter getaway Bravo beloved Summer House Southern Charm cast members friends week vacation Stowe Vermont Reach new peaks rowdy crew kicks epic experience filled hot tub hookups snowy shenanigans 10.0    ,,
Midi Première,"Midi Première is a French variety show presented by Danièle Gilbert, directed by Jacques Pierre and broadcast from January 6, 1975 until January 1, 1982 on TF1. The program was generally broadcast between 12:15 p.m. and 12:55 p.m., then giving way to the 1:00 p.m. TV news. However, the broadcast schedule could change, depending on the guests, and the setting where the recording of the program was shot. Certain performances by artists who have become cult like the one where Ringo jostles with a demonstrator in interpretation (1977), that of Dalida with the title There is always a song with the soundtrack that does not start, twice, at the right speed (1978), Claude François and his Clodettes, who, in the provinces, are unable to join ""the set"" in order to interpret his song, the latter being taken by the crowd of delirious fans (summer 1977) . The group Supertramp performed there with the title ""Dreamer"" on March 8, 1975.",112791,https://image.tmdb.org/t/p/w500/iiPXeiJHsljoyl2ZXft8Cf7pLnc.jpg,10.0,1,False,[],[],[],[],1975,Reality,"['Midi', 'Première', 'French', 'variety', 'presented', 'Danièle', 'Gilbert', 'directed', 'Jacques', 'Pierre', 'broadcast', 'January', 'January', 'program', 'generally', 'broadcast', 'giving', 'way', 'TV', 'news', 'broadcast', 'schedule', 'change', 'depending', 'guests', 'setting', 'recording', 'program', 'shot', 'Certain', 'performances', 'artists', 'cult', 'like', 'Ringo', 'jostles', 'demonstrator', 'interpretation', 'Dalida', 'title', 'song', 'soundtrack', 'start', 'twice', 'right', 'speed', 'Claude', 'François', 'Clodettes', 'provinces', 'unable', 'join', 'set', 'order', 'interpret', 'song', 'taken', 'crowd', 'delirious', 'fans', 'summer', 'group', 'Supertramp', 'performed', 'title', 'Dreamer', 'March']",Reality  Midi Première French variety presented Danièle Gilbert directed Jacques Pierre broadcast January January program generally broadcast giving way TV news broadcast schedule change depending guests setting recording program shot Certain performances artists cult like Ringo jostles demonstrator interpretation Dalida title song soundtrack start twice right speed Claude François Clodettes provinces unable join set order interpret song taken crowd delirious fans summer group Supertramp performed title Dreamer March 10.0    ,,
Love Island Games,"In this cheeky new iteration, romance meets reality as fan-favorite Islanders are faced with both team and couples' challenges, all while navigating dating, eliminations, recoupling, dramatic arrivals and new competition twists and turns like never before.",233816,https://image.tmdb.org/t/p/w500/1ACzNV3c4alBW7rUyo51n8uGoJw.jpg,10.0,2,False,[],[],[],[],2023,Reality,"['cheeky', 'new', 'iteration', 'romance', 'meets', 'reality', 'fan', 'favorite', 'Islanders', 'faced', 'team', 'couples', 'challenges', 'navigating', 'dating', 'eliminations', 'recoupling', 'dramatic', 'arrivals', 'new', 'competition', 'twists', 'turns', 'like']",Reality  cheeky new iteration romance meets reality fan favorite Islanders faced team couples challenges navigating dating eliminations recoupling dramatic arrivals new competition twists turns like 10.0    ,,
Arashi ni Shiyagare,"Arashi ni Shiyagare (嵐にしやがれ) (Must Be ARASHI!) is an ongoing Japanese variety show on NTV starring the members of Arashi. The show began on 24 April 2010 and it airs from 10:00 to 10:54 p.m. (JST) every Saturday. It is Arashi's sixth and current variety show to be aired on NTV as well as their third show to be aired during primetime. There will be a male guest, which the members of Arashi addresses as 'Aniki' (Brother), who will teach Arashi different things. The other section, called 'Encounter the Unknown', is where Arashi will pick up new skills, such as interviewing celebrities, learning the tips to climb a mountain, from meeting experienced professionals they usually have not met before.",106410,https://image.tmdb.org/t/p/w500/iUvEfCYJR1KMNpqiqG9ALuHCOTn.jpg,10.0,1,False,[],[],[],[],2010,Comedy Family Talk Reality,"['Arashi', 'ni', 'Shiyagare', '嵐にしやがれ', 'ARASHI', 'ongoing', 'Japanese', 'variety', 'NTV', 'starring', 'members', 'Arashi', 'began', 'April', 'airs', 'JST', 'Saturday', 'Arashi', 'sixth', 'current', 'variety', 'aired', 'NTV', 'aired', 'primetime', 'male', 'guest', 'members', 'Arashi', 'addresses', 'Aniki', 'Brother', 'teach', 'Arashi', 'different', 'things', 'section', 'called', 'Encounter', 'Unknown', 'Arashi', 'pick', 'new', 'skills', 'interviewing', 'celebrities', 'learning', 'tips', 'climb', 'mountain', 'meeting', 'experienced', 'professionals', 'usually', 'met']",Comedy Family Talk Reality  Arashi ni Shiyagare 嵐にしやがれ ARASHI ongoing Japanese variety NTV starring members Arashi began April airs JST Saturday Arashi sixth current variety aired NTV aired primetime male guest members Arashi addresses Aniki Brother teach Arashi different things section called Encounter Unknown Arashi pick new skills interviewing celebrities learning tips climb mountain meeting experienced professionals usually met 10.0    ,,
TO DO X TXT,"The first-ever, original variety show featuring TOMORROW X TOGETHER and their bubbly personalities off the stage!",110195,https://image.tmdb.org/t/p/w500/sQJv6CyPoZXh7gxF8TWYgFEWVIl.jpg,9.8,5,False,[],[],[],[],2020,Reality,"['original', 'variety', 'featuring', 'TOMORROW', 'X', 'bubbly', 'personalities', 'stage']",Reality  original variety featuring TOMORROW X bubbly personalities stage 9.8    ,,
GOING SEVENTEEN,"GOING SEVENTEEN is a variety show by SEVENTEEN. The show is all about SEVENTEEN doing activities, challenges and everything else.",74225,https://image.tmdb.org/t/p/w500/zZ1umKqmG2eu1uIPMeWNw4029oo.jpg,9.727,11,False,[],[],[],[],2017,Reality Comedy Talk,"['GOING', 'SEVENTEEN', 'variety', 'SEVENTEEN', 'SEVENTEEN', 'activities', 'challenges']",Reality Comedy Talk  GOING SEVENTEEN variety SEVENTEEN SEVENTEEN activities challenges 9.727    ,,
Kitchen Nightmares,"Chef Gordon Ramsay hits the road to help struggling restaurants all over the United States turn their luck around. Ramsay examines the problems each establishment faces, from unsanitary refrigerators to lazy or inexperienced staff, and searches for resolutions. With help from his team, Ramsay redecorates each eatery to give it a fresh new look and updates the menu as needed. Ramsay's ultimate goal is to make the restaurants he visits popular and profitable, but it's up to the restaurateurs to take his advice and turn their business nightmare into the American dream.",235884,https://image.tmdb.org/t/p/w500/7A1oUuJzIj3Wb3wGnLmrefZKxdb.jpg,9.7,3,False,[],[],[],[],2023,Reality,"['Chef', 'Gordon', 'Ramsay', 'hits', 'road', 'help', 'struggling', 'restaurants', 'United', 'States', 'turn', 'luck', 'Ramsay', 'examines', 'problems', 'establishment', 'faces', 'unsanitary', 'refrigerators', 'lazy', 'inexperienced', 'staff', 'searches', 'resolutions', 'help', 'team', 'Ramsay', 'redecorates', 'eatery', 'fresh', 'new', 'look', 'updates', 'menu', 'needed', 'Ramsay', 'ultimate', 'goal', 'restaurants', 'visits', 'popular', 'profitable', 'restaurateurs', 'advice', 'turn', 'business', 'nightmare', 'American', 'dream']",Reality  Chef Gordon Ramsay hits road help struggling restaurants United States turn luck Ramsay examines problems establishment faces unsanitary refrigerators lazy inexperienced staff searches resolutions help team Ramsay redecorates eatery fresh new look updates menu needed Ramsay ultimate goal restaurants visits popular profitable restaurateurs advice turn business nightmare American dream 9.7    ,,
Street Dance Girls Fighter,"Street Dance Girls Fighter aims to continue growing interest in dance by reviving the hit show, “Street Woman Fighter” with talented teenage dance crews. The crew masters from each crew appear as judges and mentors for the contestants. The teenage crews will compete to become the best high school-aged girls’ dance crew in Korea. Kang Daniel joins once again as the emcee of the show.",139727,https://image.tmdb.org/t/p/w500/xu4UR4AZ2LwVFmJJhMgclXrFg3R.jpg,9.5,2,False,[],[],[],[],2021,Reality,"['Street', 'Dance', 'Girls', 'Fighter', 'aims', 'continue', 'growing', 'interest', 'dance', 'reviving', 'hit', 'Street', 'Woman', 'Fighter', 'talented', 'teenage', 'dance', 'crews', 'crew', 'masters', 'crew', 'appear', 'judges', 'mentors', 'contestants', 'teenage', 'crews', 'compete', 'best', 'high', 'school', 'aged', 'girls', 'dance', 'crew', 'Korea', 'Kang', 'Daniel', 'joins', 'emcee']",Reality  Street Dance Girls Fighter aims continue growing interest dance reviving hit Street Woman Fighter talented teenage dance crews crew masters crew appear judges mentors contestants teenage crews compete best high school aged girls dance crew Korea Kang Daniel joins emcee 9.5    ,,
Travelawak: Projek Bapak Bapak,"A comedy reality travel show, they will have to spend time together & go through all the challenge that has been set.",223538,https://image.tmdb.org/t/p/w500/rMp4KyNiJ0IZf9YXacnSIUtf9MV.jpg,9.5,2,False,[],[],"[""Nurul A'in Mohd Noor""]",[],2023,Comedy Reality Action & Adventure Documentary,"['comedy', 'reality', 'travel', 'spend', 'time', 'challenge', 'set']",Comedy Reality Action & Adventure Documentary  comedy reality travel spend time challenge set 9.5  Nurul A'in Mohd Noor  ,,
Junior Eurovision Song Contest,"The Junior Eurovision Song Contest, often shortened to JESC, Junior Eurovision or Junior EuroSong, is a song competition which has been organised by the European Broadcasting Union (EBU) annually since 2003 and is open exclusively to broadcasters that are members of the EBU. It is held in a different European city each year, however the same city can host the contest more than once.",52832,https://image.tmdb.org/t/p/w500/p3k9G5l0dZmG4EkK57ouUaQFpBn.jpg,9.5,2,False,[],[],['Bjørn Erichsen'],[],2003,Reality,"['Junior', 'Eurovision', 'Song', 'Contest', 'shortened', 'JESC', 'Junior', 'Eurovision', 'Junior', 'EuroSong', 'song', 'competition', 'organised', 'European', 'Broadcasting', 'Union', 'EBU', 'annually', 'open', 'exclusively', 'broadcasters', 'members', 'EBU', 'held', 'different', 'European', 'city', 'year', 'city', 'host', 'contest']",Reality  Junior Eurovision Song Contest shortened JESC Junior Eurovision Junior EuroSong song competition organised European Broadcasting Union EBU annually open exclusively broadcasters members EBU held different European city year city host contest 9.5  Bjørn Erichsen  ,,
My Big Fat Fabulous Life,A series following a North Carolina woman who was diagnosed with an endocrine system disorder called polyscystic ovary syndrome (PCOS) that caused her to gain hundreds of pounds.,69880,https://image.tmdb.org/t/p/w500/xuM2Cox4WtAe8uny6i1XUxFxG7r.jpg,9.4,8,False,[],[],[],[],2015,Reality,"['series', 'following', 'North', 'Carolina', 'woman', 'diagnosed', 'endocrine', 'system', 'disorder', 'called', 'polyscystic', 'ovary', 'syndrome', 'PCOS', 'caused', 'gain', 'hundreds', 'pounds']",Reality  series following North Carolina woman diagnosed endocrine system disorder called polyscystic ovary syndrome PCOS caused gain hundreds pounds 9.4    ,,
Baddies East,"Executive Producer Natalie Nunn, Chrisean Rock, Rollie and more of the OG Baddies are back to show up and show out with newbies like Sukihana and Sky — to take over the East Coast!",234927,https://image.tmdb.org/t/p/w500/cASNGLEWbMJ3v6MNXjDwk1beT2b.jpg,9.333,6,False,[],[],[],[],2023,Reality,"['Executive', 'Producer', 'Natalie', 'Nunn', 'Chrisean', 'Rock', 'Rollie', 'OG', 'Baddies', 'newbies', 'like', 'Sukihana', 'Sky', 'East', 'Coast']",Reality  Executive Producer Natalie Nunn Chrisean Rock Rollie OG Baddies newbies like Sukihana Sky East Coast 9.333    ,,
Unexpected Business,"Set in a small, rural town, the show is about two friends, actors Zo In-sung and Cha Tae-hyun, running a supermarket for 10 days. They not only sell goods, but also operate small restaurant, where they cook and serve dishes. The two actors, who lived their whole lives in the city, experience life in the small town and blend into the neighborhood.",119645,https://image.tmdb.org/t/p/w500/xU3zUrA4gzakSoiSjpZAXnn6mTR.jpg,9.3,6,False,[],[],['Yoo Ho-jin'],[],2021,Talk Reality,"['Set', 'small', 'rural', 'town', 'friends', 'actors', 'Zo', 'sung', 'Cha', 'Tae', 'hyun', 'running', 'supermarket', 'days', 'sell', 'goods', 'operate', 'small', 'restaurant', 'cook', 'serve', 'dishes', 'actors', 'lived', 'lives', 'city', 'experience', 'life', 'small', 'town', 'blend', 'neighborhood']",Talk Reality  Set small rural town friends actors Zo sung Cha Tae hyun running supermarket days sell goods operate small restaurant cook serve dishes actors lived lives city experience life small town blend neighborhood 9.3  Yoo Ho-jin  ,,
Dimension 20,"Heed the call of adventure and enter Dimension 20 where Game Master Brennan Lee Mulligan, joined by comedians and pro gamers, blends comedy with tabletop RPGs.",89180,https://image.tmdb.org/t/p/w500/eekcVkJUCQFQOyu3ZulaLOlgDtc.jpg,9.222,9,False,[],[],['Brennan Lee Mulligan'],[],2018,Sci-Fi & Fantasy Comedy Reality Action & Adventure,"['Heed', 'adventure', 'enter', 'Dimension', 'Game', 'Master', 'Brennan', 'Lee', 'Mulligan', 'joined', 'comedians', 'pro', 'gamers', 'blends', 'comedy', 'tabletop', 'RPGs']",Sci-Fi & Fantasy Comedy Reality Action & Adventure  Heed adventure enter Dimension Game Master Brennan Lee Mulligan joined comedians pro gamers blends comedy tabletop RPGs 9.222  Brennan Lee Mulligan  ,,
LOL: Last One Laughing Colombia,"For the first time in Colombia, LOL opens its doors to 10 of the best comedians to compete against each other to win the LOL trophy while they dare to make comedy free of censorship and limits. In this crazy extreme experiment, comedians will reveal much more than their repertoire of jokes. What will be their challenge? Make each of their opponents laugh while keeping a straight face.",231804,https://image.tmdb.org/t/p/w500/bo4UKcVWwX2T5HA5UsFXTXcoUsy.jpg,9.077,13,False,[],[],[],[],2023,Reality Comedy,"['time', 'Colombia', 'LOL', 'opens', 'doors', 'best', 'comedians', 'compete', 'win', 'LOL', 'trophy', 'dare', 'comedy', 'free', 'censorship', 'limits', 'crazy', 'extreme', 'experiment', 'comedians', 'reveal', 'repertoire', 'jokes', 'challenge', 'opponents', 'laugh', 'keeping', 'straight', 'face']",Reality Comedy  time Colombia LOL opens doors best comedians compete win LOL trophy dare comedy free censorship limits crazy extreme experiment comedians reveal repertoire jokes challenge opponents laugh keeping straight face 9.077    ,,
On Cinema,Tim Heidecker reviews the latest movies in theaters with a special guest.,76345,https://image.tmdb.org/t/p/w500/li5qk9Hdm2Yrw1ApXpT5UNAUxAY.jpg,9.071,15,False,[],[],"['Tim Heidecker', 'Gregg Turkington']",[],2012,Comedy Talk Reality News,"['Tim', 'Heidecker', 'reviews', 'latest', 'movies', 'theaters', 'special', 'guest']",Comedy Talk Reality News  Tim Heidecker reviews latest movies theaters special guest 9.071  Tim Heidecker Gregg Turkington  ,,
MasterChef: Dessert Masters,"Some of the most exciting names in pastry, desserts and all things sweet and delicious will bring their elite skills to the competition as they contend to be the nation’s first Dessert Master, and with $100,000 on the line, the pressure is on not to fudge it up.",227551,https://image.tmdb.org/t/p/w500/ijNZvOetNOFeVnJqYCW8cZVOmGU.jpg,9.0,1,False,[],[],[],[],2023,Reality,"['exciting', 'names', 'pastry', 'desserts', 'things', 'sweet', 'delicious', 'bring', 'elite', 'skills', 'competition', 'contend', 'nation', 'Dessert', 'Master', 'line', 'pressure', 'fudge']",Reality  exciting names pastry desserts things sweet delicious bring elite skills competition contend nation Dessert Master line pressure fudge 9.0    ,,
Salty Tour,"Salty Tour is a travel variety program that emphasises on 2 things: Good quality for the price and Small Luxury. For every city/country, 3 of the cast members are assigned as 1-day tour guides and are given the same budget per person. The cast members will attempt to have the best vacation experience with a fixed price limit. The Small Luxury can only be won by the winning tour guide through the judging of the remaining cast members and invited guests for each day tour, in terms of food, places of interest and accommodation.",77988,https://image.tmdb.org/t/p/w500/sNeWYRtQ1FVwPDgYdCXaYhGMkVM.jpg,9.0,1,False,[],[],[],[],2017,Reality,"['Salty', 'Tour', 'travel', 'variety', 'program', 'emphasises', 'things', 'Good', 'quality', 'price', 'Small', 'Luxury', 'city', 'country', 'cast', 'members', 'assigned', 'day', 'tour', 'guides', 'given', 'budget', 'person', 'cast', 'members', 'attempt', 'best', 'vacation', 'experience', 'fixed', 'price', 'limit', 'Small', 'Luxury', 'won', 'winning', 'tour', 'guide', 'judging', 'remaining', 'cast', 'members', 'invited', 'guests', 'day', 'tour', 'terms', 'food', 'places', 'interest', 'accommodation']",Reality  Salty Tour travel variety program emphasises things Good quality price Small Luxury city country cast members assigned day tour guides given budget person cast members attempt best vacation experience fixed price limit Small Luxury won winning tour guide judging remaining cast members invited guests day tour terms food places interest accommodation 9.0    ,,
MTV Hustle,"MTV Hustle is India's first rap reality show. Judged by Raftaar, Nucleya and Raja Kumari, it premiered on 9 August 2019. Hosted by Gaelyn Mendonca, it airs on MTV India.",94537,https://image.tmdb.org/t/p/w500/eZQDMRq2qYIueg1nNkKaakWRPfs.jpg,9.0,1,False,[],[],[],[],2019,Reality,"['MTV', 'Hustle', 'India', 'rap', 'reality', 'Judged', 'Raftaar', 'Nucleya', 'Raja', 'Kumari', 'premiered', 'August', 'Hosted', 'Gaelyn', 'Mendonca', 'airs', 'MTV', 'India']",Reality  MTV Hustle India rap reality Judged Raftaar Nucleya Raja Kumari premiered August Hosted Gaelyn Mendonca airs MTV India 9.0    ,,
Robinson Ekspeditionen,"Robinson Ekspeditionen is a popular Danish reality television program debuting in 1998. In the spring of 1998 TV3 purchased the broadcast rights to air their own version of Expedition Robinson. Following the success of the Swedish version, Denmark was the first country to adopt their own version of the show. The show has proven to be a ratings success since its premiere in 1998.

The name alludes to both Robinson Crusoe and The Swiss Family Robinson, two stories featuring people marooned by shipwrecks.",32718,https://image.tmdb.org/t/p/w500/m2TxgzRvqXR74bA08ZVNl7q0cU6.jpg,9.0,4,False,[],[],['Charlie Parsons'],[],1998,Reality,"['Robinson', 'Ekspeditionen', 'popular', 'Danish', 'reality', 'television', 'program', 'debuting', 'spring', 'purchased', 'broadcast', 'rights', 'air', 'version', 'Expedition', 'Robinson', 'Following', 'success', 'Swedish', 'version', 'Denmark', 'country', 'adopt', 'version', 'proven', 'ratings', 'success', 'premiere', 'alludes', 'Robinson', 'Crusoe', 'Swiss', 'Family', 'Robinson', 'stories', 'featuring', 'people', 'marooned', 'shipwrecks']",Reality  Robinson Ekspeditionen popular Danish reality television program debuting spring purchased broadcast rights air version Expedition Robinson Following success Swedish version Denmark country adopt version proven ratings success premiere alludes Robinson Crusoe Swiss Family Robinson stories featuring people marooned shipwrecks 9.0  Charlie Parsons  ,,
